txt,label
"stars: Julianna Donald, Lonny Price and Louis Zorich. cameos: Art Carney, Brooke Sheilds, Liza Minelli, James Coco, Joan Rivers, Dabney Coleman, Linda Lavin, Gregory Hines and others.<br /><br />Muppeteers: Jim Henson as Kermit, Rowlf, Dr.Teeth, Swedish Chef, Waldorf, Ernie and others.<br /><br />Richard Hunt as Scooter, Janice, Statler and Beaker.<br /><br />Frank Oz as Fozzie Bear, Miss Piggy, Animal, Bert, Cookie Monster and Sam the Eagle.<br /><br />Jerry Nelson as Camilla the chicken, Floyd Pepper, Lew Zealand, Crazy Harry and Pops.<br /><br />Dave Goelz as Gonzo, Zoot, Beuregard and Bunsen Hunnydew.<br /><br />Steve Whittemire as Rizzo the rat and others.<br /><br />Another great Muppet flick. This time, Kermit, Fozzie, Miss Piggy, Scooter, Rowlf, The Electric Mayhem, Gonzo and Camilla the chicken are out of college and starring in a musical that they're trying to get on Broadway. After miserably failing at getting it produced, they all split up and go their separate ways. I love the characters and cameos. The songs in the film are ""Together Again"", ""Look at Me, Here I am"", ""Saying Goodbye"", ""And I'm Going to Always Love You"", ""Rat Jazz"" and ""He'll Make Me Happy"". Frank Oz directs this movie excellently and all the actors do a great job acting like the Muppets are real. See it! 91 minutes. Rated G. My rating: A.",pos
"""Nothin'. There ain't nothing' in Room 237. But you ain't got no business going' in there anyway. So stay out. You understand? Stay out."" <br /><br />Never has there been such a feat of psychological horror as this film achieves. This is the highest rated horror film of all and rightly so. Jack nicholson is a superb actor and this is one of the greatest performances in cinema.<br /><br />Its about a family moving to an isolated and deserted hotel for 5 months over the winter. Then the father (Jack) becomes almost possessed by the horrors in the hotel.<br /><br />Kubricks direction is nothing short then perfect. The tense tracking shots, agonising music, mystical messages and perplexing plot makes this the best horror film ever made.<br /><br />Throughout the film there is constant references to danger, death and horror. Red is used in EVERY scene. Is the red purposely put in by Kubrick? Of course!.<br /><br />This is a definitive Kubrick classic and this is the third of his films I have given 10/10. He is a perfectionist in his direction and you can see it in all his films. He loves to perplex his watchers in everyone of his films.<br /><br />I will be talking about this film for months to come. It has infinite depth.<br /><br />In conclusion, this is the cornerstone of horror and tension. A masterpiece of terror 10/10",pos
"Each of the major studios cranked out jazzy one-reelers throughout the thirties and forties (with Universal taking the lead). While most looked as cheap on screen as they were to make, Warner Bros. (which abruptly stopped making them in 1946) often distinguished theirs with offbeat camera angles, mirrors and optical effects, thanks to some creative directors like Jean Negulesco. It is fitting that the best of this genre should come from this studio.<br /><br />What sets ""Jammin' The Blues"" apart from the rest of the pack is that it more closely resembles an avant-garde experiment than a Hollywood musical. Filmed in July 1944, it transforms an ordinary jam session into a ""trippy"" dream-escape from war-time troubles, highlighted by the tune of ""On The Sunny Side Of The Street"". Gjon Mili and cameraman Robert Burkes (later to work with Hitchcock) were allowed plenty of artistic freedom, perhaps because Lester Young was not Glenn Miller and the studio could care less how he and his fellow musicians were presented. The optical printer is put to good use, with multiple images of the same performer appearing at once. (Norman McLaren really milked this process two decades later in ""Pas De Deux"", while Linwood Dunn's team achieved different effects in ""Citizen Kane"".) The strong emphasis on silhouettes and lit cigarette smoke was also ahead of its time; in some ways, this predated the psychedelic sixties, but with a distinctly forties film noir style.",pos
"I saw this movie on TV when it came out, and never seen it again. For the life of me, I couldn't remember the title and just stumbled across it while checking Roy Thinne's movie credits. Excellent, dark, and spooky TV horror movie in the same class as ""Crowhaven Farm""; ""Don't Be Afraid Of The Dark""; and ""Satan's School for Girls"", all lost Satanic classics. I also think it has many parallels to Clint Eastwood's classic, ""High Plains Drifter"". Why don't they release these great little movies, especially when you consider all of the more recent garbage that fills the discount DVD racks at Wal-Mart? Most of these flicks have a cult-following, so sales shouldn't be a problem.",pos
"Holy crap this is so hysterical! Why aren't American comedies written like this? For anybody who thinks comedy has to be dumb-- there is more wit and intelligence in the six episodes of this series than in a shelf of novels! Hugh Laurie is a complete hoot. I couldn't believe it was the same guy as House! There are so many great lines and gags in this series you could watch each show dozens of times and still pick up on new things each time. Rowan Atkinson is hilarious as the verbose and put upon butler Edmund. This is my favorite of all the Blackadder series. And Tony Robinson is wonderful as ever as the somewhat obtuse heart of the series, ""the oppressed mass"" Baldrick. Some of my favorite lines: ""When someone messes with a Wellington he really puts his foot in it"" and Baldrick explaining how he got his name and cousin Macadder ""the top kipper salesman"" and homicidal swordsman from Scotland.",pos
"Overall I found this movie quite amusing and fun to watch, with plenty of laugh out loud moments. <br /><br />But, this movie is not for everyone. That is why I created this quick question-ere, if you answer yes to any of the following questions than I recommend watching this flick<br /><br />(1)Do you enjoy crude sexual humor? (2)Do you enjoy alcohol related humor? (2)Do you enjoy amazingly hot girls? (3)Do you enjoy viewing boobs? (4)Do you enjoy viewing multiple boobs? (5)Did I mention all the nice boobies in this film?<br /><br />If you noticed the spoiler alert, that is referring the mass amount of nudity you can expect in the movie, I myself have no idea what the plot was about. Not that it matters.",pos
"I gave this film 10 not because it is a superbly consistent movie, but for it's pure ability to evoke emotions in its audience. The story of one-woman's-struggle-against-all-odds is an old cliché by now, but very few films have carried it off with so much warmth and sincerity as The Color Purple.<br /><br />It also showed a different side to the African-American experience - showing that after slaves were granted freedom many fell into the ways of the hated 'white man' and were abusive of their own people. I find this an important point as it goes against the portray-white-on-black-violence-and-win-an-Oscar trend.<br /><br />Also the acting performances are superb - especially Oprah who I now have a new found respect for.<br /><br />Well worth watching - but keep some tissue handy.",pos
"This movie stars Emily Watson, of Breaking the Waves fame. This movie about one man's obsession takes place at a resort where a chess tournament is being held. A chess master arrives and shortly after falls madly in love (at first sight) with a woman, played by Emily Watson. She falls for this oddball of a man, who is obsessed with chess. This is all at the dismay of her mother, who is far more interested in seeing her with another young gentleman; a proper gentleman. Her mother feels that this is just a passing fancy for the young woman, as she has a tendency to take in odd animals and such. What ensues is mostly a journey through the man's psyche. It tells the story of how his past is closely tied with his present. Emily Watson is amazing in this, as well as the actor who plays the main character. It is definitely slow, but is well worth the watching. The ending was even satisfying. :)",pos
"THE TENANTS began as a 1971 short novel by the now deceased Bernard Malamud - writer/philosopher - examining the conflicts between Jews and African Americans in the incendiary atmosphere of Brooklyn at the time the book was written. As a novel the story was gut wrenchingly real: as transcribed into a screenplay by novices David Diamond and Danny Green (who also directs) it is more of a cerebral dissertation that gradually erupts into action in the final moments.<br /><br />Harry Lesser (Dylan McDermott) is a Jewish novelist with one book under his belt but currently attempting to finish his 'newest' book ten years into the writing. Convinced that he must complete the novel in the same environment where it was started. he is the sole tenant in a condemned Brooklyn tenement owned by Levinspiel (Seymour Cassel) who constantly tries to 'buy out' Harry's lease so that the filthy dilapidated building can be demolished. Into this atmosphere enters another Black militant quasi-anti-Semitic writer Willie Spearmint (Snoop Dogg) whom Harry befriends, hides, and offers help to the nascent novelist's attempt to write about the death of all white people. Harry's attempts to help Willie lead to conflict, not the least of which is Harry's meeting Willie's girlfriend, the white Jewish Irene Bell (Rose Byrne) at a less than friendly gathering of Willie's militant black brothers and sisters. Willie and Irene are on the skids and Harry gradually falls in love with Irene and they plan to leave New York as soon as Harry finishes his novel. When Willie hears of the assignation and is further critiqued by Harry, Willie explodes and begins the downward descent of not only a delicate friendship but also a competition between writers. The ending 'reveals the slippery nature of the human condition, and the human capacity for violence and undoing'.<br /><br />The actors do their best with a script that is a bit awkward but despite scripted lines that border on preaching they create believable characters. The cinematography enhances the story, keeping the mood dank and dense and primarily confined to the condemned building. The musical score appropriately makes use of the solo jazz trumpet and blues piano to underline the tension and isolation of each of these groundless characters. Though it takes some patience to make it through the cerebral ramblings, the film in the end is worth watching. At least it attempts to recreate Malamud's bizarre look at life in the big city. Grady Harp",pos
"Of course the plot, script, and, especially casting are strong in the film. So many fine things to see. One aspect I liked especially is the idea of the antagonist--Luzhini's (Turturro's)--ex-mentor working his evil on the sidelines. His chess opponent--an Italian dandy in three piece and cane--turns out to be a real gent, and a truly fine chess player. To his credit the ""opponent"" nobly goes along with the plan at the end to complete the final game for the championship posthumously (Luzhin has taken a flyer out a window--sad, but so releasing to him)by way of the unstable genius' widow (Emily Watson.) In death, then, because of the gallantry of an honorable chess master, Luzhin's defence (which he worked out in a late moment of lucidity) is allowed to be played. The Italian gent commends the play and calls it brilliant. Talk about a dramatic ""end game!""",pos
"Ever read Jim Thompson? He's hard-boiled noir with the most extreme fatalism and misanthropy I've ever encountered. There are rarely private detectives in his work - just losers, psychotics and small-time con artists. This film has Thompson nailed - ""If God made any real mistakes in this world, it was in giving us a will to live when we've got no excuse for it."" Every character in the film balances on a razor's edge between surreal and creepy realism. There's sleazy, conniving Uncle Bud, played by Bruce Dern and spookily well-intentioned Doc Goldman played by George Dickerson. Jason Patric gives a wonderful, often heart-wrenching performance as Kid Collins, a none-too-bright, shy ex-fighter who's more scared of himself than of anyone else. Rachel Ward is Fay, the sexy femme fatale who we can't quite figure out...It's not your standard film noir, nor is it intended to be. After Dark My Sweet, along with The Grifters, are two excellent adaptations of novels by one of my favorite writers, Jim Thompson.",pos
"Even though we know how the story ends, this is a gripping fly-on-the-wall film that plays almost like a political thriller. During the calm before the storm, we meet Hugo Chavez as a charismatic, larger than life man who has an unbreakable connection with the mestizos who make up 80% of the population but have previously been shut out of Venezuela's political process and its oil wealth. He seems as devoted to them as they are to him. He travels the country at a hectic pace, reaching out to the campesinos, addressing huge crowds, hugging and kissing ordinary people, accepting letters on scraps of paper, and hearing pleas for help. The people are excited that one of their number has made it to the highest office in the land. There is an electric sense of hope and optimism that change for the better is coming to the festering barrios.<br /><br />But not everyone is happy with the situation. The pure-blood Castillian Spaniard elite who are a small minority but previously controlled all the wealth are full of bitterness and resentment. One of the most unintentionally hilarious moments in the film is when an Ann Coulter lookalike, at a residents' meeting in an exclusive gated community, complains of the mestizos, ""they have no concept of struggle or sacrifice."" Minutes later, a speaker tells the meeting to ""beware of your domestic servants - they could be Chavez supporters."" Duh! Of course they are.<br /><br />In a late night interview alone with the film crew, Chavez reveals something of his soul as he tells the story of his grandfather. He can be a sensitive, poetic person, though with an impish, even clownish, sense of humor (like we saw when he addressed the UN and called Bush the devil.)<br /><br />Then the storm starts to gather force as the coup organizers call for a mass protest and cynically manipulate their supporters into changing the route at the last minute and marching on the presidential palace, knowing it is surrounded by Chavez supporters and violence is inevitable.<br /><br />Another element of the plot falls into place as snipers on rooftops begin to fire on the Chavez supporters, some of whom fire back. The local equivalent of Fox News shows this return fire and claims that Chavez supporters are massacring protesters. Then the camera pulls back and reveals that there are no protesters - the street is empty! The protesters took a different route. Needless to say the footage of the empty street was edited out by the rabidly anti-Chavez private TV stations (who had been airing a constant barrage of propaganda calling Chavez mentally ill and sexually fixated on Fidel Castro.) Immediately after the coup, we see the ringleaders and their media propaganda masters openly bragging on TV about how they had manipulated the situation with reckless disregard for the lives of supporters and opponents alike.<br /><br />The filmmakers continue to be at the heart of this chaotic, fast-changing situation as the military coup surrounds the palace and threatens to bomb it. Chavez eventually surrenders to avoid bloodshed but refuses to resign and is whisked away to an offshore island where a plane awaits to take him - where? The US? How can the remaining cabinet members avoid arrest and defeat this heavily armed conspiracy of right-wing generals and ultra-wealthy businessmen who are closely linked to the Bush administration? Watch the movie and find out!<br /><br />If your only knowledge of Hugo Chavez and Venezuela is from the US media, then you know nothing. He is not an ""unelected tyrant"" and does not ""rule by decree"" - he is enormously popular, having been elected and re-elected several times with over 60% of the vote (something George Bush Junior has never achieved) and the devotion he inspires in ordinary Venezuelan people is ultimately the reason why the coup fails.<br /><br />This is an extraordinary film about an extraordinary man in an extraordinary situation. The skill of the filmmakers is in being unobtrusive and letting the story unfold through the voices of Venezuelans at every level from the barrio to the presidential palace, the tumultuous scenes, the chaos and confusion out of which a coherent whole emerges that is tense, riveting and moving. Not to be missed!",pos
"A man and his wife get in a horrible car accident. When the wife is left in a persistent vegetative state, the man must choose between pulling the plug and letting her live. The decision is made even harder when he realizes her ghost wants to extract revenge on him and those around him.<br /><br />This comes to us from director Rob Schmidt, who made ""Wrong Turn"" (a film I have not seen). With only one horror film under his belt, and not a particularly notorious one at that, I was a bit reluctant to watch this episode, expecting Schmidt to be a ""Master of Horror"" in only the most liberal sense. My apologies to him for my underestimation. As of episode 10 in a 13 episode season, this was actually the best one yet.<br /><br />The issue of the ""right to die"" is dealt with and covered in enough detail to be a solid plot device. However, this is only the foundation on which the story revolves. Once the horror elements show up, the film goes from ""decent"" to ""spectacular"". Great acting, great plot, great dialogue, great suspense. I was a little creeped out at times (which is good) and most of all: the gore is in extreme abundance! I read a review of this episode prior to watching it, where the reviewer said there is a strong hint of ""Hellraiser"" in this. Through the first part of the show, I had no idea what they were talking about. Then there is a bit later where some images do remind me of ""Hellraiser 2"". However, I in no way wish to say that this takes away from the film. I can see no other way to create the effect that was created, and in my opinion this looks remarkably better than ""Hellraiser 2"".<br /><br />Some plot twists show up later on, and might invite the viewer to give the film a second look. I didn't watch it a second time, but I think the beginning would make more sense if I had (not that it's confusing). The subplot with the dental hygienist is also nice, and I found myself going back and forth about whether I disliked the main character for his relationship with her or if I felt bad for him. He's somewhat of an anti-hero to the whole story, if you will. I feel inclined to cheer for him as the protagonist, but he's completely unlovable.<br /><br />While the Stuart Gordon episode may be better and I'm excited about the ""Washingtonians"" episode, I think I could safely bet that this is the key episode of the season and by far the saving grace of what was otherwise lackluster and routine. When legends like John Carpenter let me down (again) I get a bit worried about the genre's future, but then a fresh face like Rob Schmidt comes along and gives me hope. This one is a keeper, and please bring Schmidt back for season 3!",pos
"There was a stylish approach to this film on the part of director Vincenzo Natali with interesting camera angles and effective close-ups. It was also refreshing to see Jeremy Northam and Lucy Liu given leading roles and expanding their range as performers. This film also included one of the most imaginative ""escape"" scenes in recent years. The efforts of the director and the actors combined in an effective thriller.<br /><br />Although the plotting of the film was convoluted, the story progressed very clearly as the layers of corporate greed and skullduggery were revealed.<br /><br />In 1949, George Orwell suggested in his famous novel ""1984"" that the future would be ruled by the totalitarian State, which would control minds and diminish human liberty. It was interesting that in this intriguing futuristic film, it was not the State, but rather the corporate world that controlled and devalued the human worker.",pos
"And I really mean that. I caught it last night on Vh1, and I was not expecting it to be so good. This is now one of my favorites. I must add that it has a killer soundtrack.",pos
"To anyone who might think this show isn't for them, please give it a try. Network television has degenerated into shows that are clones of clones or are reality based shows featuring some often unreal people. This show is a return to family oriented TV where the emphasis is on learning some life lessons, learning what real friends and family are about, and maybe even learning a little bit about our national pastime. Jeremy Sumpter is one of the most appealing young actors in show business today, and he is perfectly cast as the young, slightly naive new batboy for the fictional New York Empires (great name!). Dean Cain, Christopher Lloyd, Mare Winningham, and Kirsten Storms round out the main cast, and they are all exceptional. This show deserves a chance to catch on and be seen. Hopefully it will stick around for a few seasons and we can watch Pete Young (Sumpter's character) learn and grow.",pos
"Okay, this film probably deserves 7 out of 10 stars, but I've voted for ""10"" to help offset the misleading rating from the handful of bozo's who gave this film zero or 1 star reviews. Each of the segments for this anthology shows great potential and promise for the talented filmmakers... three of whom have gone on to achieve notable success in big-time Hollywood productions. Performances range from rough all the way up to completely impressive, with notable turns by Bill Paxton, James Karen, Vivian Schilling and Brion James. Martin Kove may be a big melodramatic as the psychotic hypnotist with the bizarro strobe-lamp, and Lance August seems intentionally dimwitted as an unsuspecting lab victim. But overall, it's got some great laughs and some genuinely scary moments. Definitely worth seeing, so judge for yourself!",pos
This movie is one exception of the rule that a sequel is worser than the original. Its comedy at its best. This movie is a fast action slapstick comedy where something seems to happened every second. At more than one occasion the entire audience laughed loudly at a joke.<br /><br />Its a big advantage to have seen the first movie but its not a requirement.<br /><br />Göta kanal 2 also have the advantage of being a parody on the latest decades reality production TV series such as survivor (expediton: Robinson in Swedish) This is a Swedish movie for the Swedish audience. Thus don't see it if you aren't familiar with Sweden and its language. Otherwise: Have fun! Johan,pos
