txt,label
"The majority of Stephen King's short stories are little gems, with original ideas that don't take a long time to develop; basically lean and mean--he sets them up quickly in a scarce number of pages, you read 'em, and you're finished before you know you've begun. They're like the equivalent of a carton of McDonald's fries--they taste Really good and you know there's not much nutritional value in them (re: from a literary standpoint, they don't say much about the universal human condition), but you're still gonna scarf 'em down, just don't be a pig and go for the extra-super-sized portion and fill up on too much grease (""too much grease"" is a metaphor for the prose in King's novels when find yourself reading one of them and saying come on--enough with the pop-cultural observations or clever Yankee asides--get on with the story already!) He has compiled four books of short story collections. I've read them all--from NightShift to the latest, Everything's Eventual, and they all display an efficiency of getting-to-the-point which is sometimes sorely lacking in his tome-sized novels.<br /><br />But his short stories never overstay their welcome...which brings us to the TV adaptations of Nightmares And Dreamscapes...<br /><br />How in the hell did they (the series' producers) get a green-light to turn stories that usually averaged 15 pages into 50 minute episodes? I'll tell you how--two words--""Stephen King."" Stories with his name on them probably didn't come cheap, and one hour shows enable more advertising than half hour ones, so...what should have been an anthology of mostly 23 or 24 minute episodes is turned into double that length, and double the commercial time...Ka-Ching!<br /><br />I'm not going to waste time synopsizing the plots of these stories--this review supposes you have already read the stories and/or seen the show; what follows is merely my gut reactions to what TNT presented... Of the four installments so far, here's my ten cent assessment (from first to worst): <br /><br />Battleground-- Not a classic by any means, but hey, how could anyone argue with keeping William Hurt from opening his trap by filming this episode without a single line of dialog? And the tongue-in-cheek reference and destruction of the killer Zuni doll from Trilogy Of Terror proved to me the producers (and the writer of the teleplay, who is Richard Matheson's son--the writer of TOT) knew their mission with this one was to make the action deadly, yet at the same time, fun. It took longer to get to Hurt's apartment than it should have, but I think it fulfilled it's objective. 8/10<br /><br />Umney's Last Case-- Liked this one primarily because of William H. Macy's performance. I think the writer/Umney should have appeared in the story sooner into the private eye/Umney beginning because he was the actual reality of the story, and anyone familiar with the King short story (probably half, if not more of the audience) knew the Chandleresque set-up was due to get interrupted by the writer's reality, so let's get on with it already, and cut-out the cute and clever hard-boiled repartee' Private Dick banter already. Once the writer/Umney's family tragedy began to reveal though, I thought the show developed an emotional connection that made the viewer (me, at least), feel sympathy for the real-life Macy's attempt to escape his sorrows by usurping his fictional creation's exciting life. 6/10 <br /><br />The End Of The Whole Mess-- Uh, this title is how I felt about this episode when it was over. After twenty minutes, I was ready to scream at the TV--OK, we get it already, the younger brother is a Mega Mensa Genius Prodigy Extraordinaire! We know from Ron Livingston talking to the camera (""time is running out for me""--not fast enough, I thought) that the young whiz kid is going to discover something really bad for humanity--we know this because he's already built an airplane but almost died because he couldn't steer it out of the path of a tree; and, he blew up his chemistry lab while teaching himself chemistry (to think the end of the world could have been prevented if only this kid had some more parental supervision). So much time was wasted on establishing the uber-genius of Henry Thomas, when we finally get to the resolution of his discovery--the end of the world through unintended idiocy--how much do we get to see of the world ""ending?""--a cheap video shot of a reporter starting to forget what she's reporting on, and brief radio broadcasts announcing the day of judgement is at hand. Oh, and the brother's parents drooling and singing old songs. My point is, if your story is really about the ""end of the whole mess (world)"", I wanna see the ""mess"" as it goes up in flames and crashes and burns. Talk about ending with a whimper, indeed. 2/10 <br /><br />Crouch End-- This episode just ticked me off totally. I could have lived with the taking-forever exposition of the happy couple arriving at their hotel, playing slap-and-tickle, having lunch, and getting a taxi (that was half the episode right there), if once they finally crossed-over into Crouch End the episode delivered the chills, but it failed miserabley. Not only wasn't it scary, it was practically laughable. Ooh, look--a kitty...wait, it turns...oh my god! Look at it's scary eye! Uh-huh. They could have gone a long way towards filming the Crouch End sequence at night instead of in daylight, too. Things you might unintentionally find funny can become scarier when you see them in the night shadows. But I guess the budget wasn't high enough to shoot at night on the fake London sets they slapped together for this one. On the page, this is a very scary story about tourists wandering into places they shouldn't and the terrible things that might lurk just around a corner there. The only terror in this adaptation was the directing and acting--those were truly horrifying. 1/10 <br /><br />Overall Series Average (so far): 4/10",neg
"I was browsing through Netflix and stumbled upon this movie. Having fond memories of the book as a child, I decided to check this out. This is a movie that you should really pass on.<br /><br />It is just not worth seeing. It is very boring and uninteresting. I feel that it would even be that way to small children. It has no magic that the book contains. This movie is not horrible, but you will just find yourself not caring ten minutes into it.<br /><br />There are moments that just come off as weird. The witch character is not very good. The family acts like it is no big deal that these odd things are happening. I know this is a kids movie, so as an older audience we must not look too deeply in things, but the whole movie just feels like it was written and produced by people who have never had any movie making experience before.<br /><br />The DVD that I had began skipping in the final moments of the film, and instead of trying to fix it I just turned it off and sent it back to Netflix. I really didn't care how it finished. Skip this film and read the book instead.",neg
"This movie rivals ""Plan 9"" as one of the dumbest movie ever made. Always be concerned when the same person is the:<br /><br />1. Star 2. Director 3. Producer 4. Writer 5. Stuntman, and 6. Editor. Unfortunately, Justin Kreinbrink did all 6 jobs! IMDb shows that he and his father were western 'stunt men'. So maybe that was the problem. <br /><br />Here's just ONE example from the film: in the film the sheriff has to take a witness to another town for protection. Of course, the bad guys find out and are waiting for them. But, what happens? The good guys are riding along and a shot rings out and hits a tree near them. When the camera shows us the bad guys they're all just sitting on a log, chatting. What's wrong with this picture!<br /><br />I could go on. Perhaps this film was meant as a comedy. If so, it didn't do that well either.",neg
"Stefan is an x-con that five years ago got married to Marie. Their marriage has been stable until Stefan past catch up with them and he's offered to do a courier job. Stefan's job is a heroin delivery from Germany to Sweden which should go easily.<br /><br />In Germany Stefan meet Elli, a girl from Bosnia that has been sold to a stripclub owner. Stefan dislikes what he sees and decide to help Elli out of her misery. Due to the fact that Elli's father during the war fleed to Sweden Elli now goes with Stefan to Sweden. To make up with the past Stefan promises Elli to help her find her father, no matter what it takes. Finally back in Sweden the whole situation seems to be more complicated than Stefan ever thought of..<br /><br />This movie doesn't seem to fit in the ordinary class of swedish movies due to the fact that it's been americanized alot. Regina Lund and Cecilia Bergqvist makes it all average, the effects makes the movie a little too much though. See it and jugde for yourself.<br /><br />",neg
"Okay, I remember watching the first one, and boy did it suck. After watching it, I just laughed it off and told myself, ""oh boy, just another low budget B-movie. I'll never see a part 2 to this one."" Then, about 1 1/2 years later, there came part two. It sucked even more. But, I just laughed it off again and said, ""there's no way I'm ever gonna see a part 3 to this one."" Then, about 1/2 a year later, part 3 came out. I was stupid enough to rent it and boy, I just snapped after watching it. God, I never actually realized how much movies can suck these days. Just save yourself $7.50 and don't rent the whole series. Trust me, it's worth every penny.",neg
"""Perhaps we can arrange a meet. "" ""Where are you now? "" ""I'm sitting in my office. "" ""I doubt that. "" ""Why would you doubt that? "" ""If you were in your office right now we'd be having this conversation face-to-face. ""<br /><br />Bourne remains street tough, and elusive. Only his inhuman resilience leads the film a little too far into fantasy. Conversation is macho, to the point with only shards of Bond type gallows humour. Its all about the action.<br /><br />The feeling that there is something going on at another level to the world we live in is what the trilogy coveys so well. A scene set in Waterloo with a Guardian journalist does this to great effect. There is no meeting of worlds - you are in it or just a superfluous body.<br /><br />If the shaky cam doesn't annoy you too much, enjoy this film and hope they somehow keep the franchise going.",pos
"This movie is horrible- in a 'so bad it's good' kind of way.<br /><br />The storyline is rehashed from so many other films of this kind, that I'm not going to even bother describing it. It's a sword/sorcery picture, has a kid hoping to realize how important he is in this world, has a ""nomadic"" adventurer, an evil aide/sorcerer, a princess, a hairy creature....you get the point.<br /><br />The first time I caught this movie was during a very harsh winter. I don't know why I decided to continue watching it for an extra five minutes before turning the channel, but when I caught site of Gulfax, I decided to stay and watch it until the end.<br /><br />Gulfax is a white, furry creature akin to Chewbacca, but not nearly as useful or entertaining to watch. He looks like someone glued a bunch of white shag carpeting together and forced the actor to wear it. There are scenes where it looks like the actor cannot move within, or that he's almost falling over. Although he isn't in the movie that much, the few scenes are worth it! Watch as he attempts to talk smack to Bo Svenson, taking the Solo-Chewbacca comparison's to an even higher level! <br /><br />I actually bought this movie just because of that character, and still have it somewhere! <br /><br />Gulfax may look like sh!t, but he made this movie!!! The only reason I've never seen the sequel, or even sought it out, was because of his absence! Perhaps should there be a final film, completing the trilogy, Gulfax will make a much-anticipated return!",pos
"Despite some reviews being distinctly Luke-warm, I found the story totally engrossing and even if some critics have described the love story as 'Mills and Boon', so what? It is good to see a warm, touching story of real love in these cynical times. Many in the audience were sniffing and surreptitiously dabbing their eyes. You really believe that the young Victoria and Albert are passionately fond of each other, even though, for political reasons, it was an arranged marriage. I did feel though that Sir John Conroy, who was desperate to control the young Queen, is perhaps played too like a pantomime villain. As it is rumoured that he was in fact, the real father of Victoria (as a result of an affair with her mother The Duchess of Kent) it would have been interesting to explore this theory. Emily Blunt is totally convincing as the young Princess, trapped in the stifling palace with courtiers and politicians out to manipulate her. She brilliantly portrays the strength of character and determination that eventually made Victoria a great Queen of England, which prospered as never before, under her long reign. I believe word of mouth recommendations will ensure great success for this most enjoyable and wonderful looking movie.",pos
"Having seen CUBE, I've been a fan of Vincenzo Natali's work. Natali seems to have this inept ability to take a storyline, and hardly wring it our like a wet towel for all the storyline he can muster. Instead, he lets the stories themselves unfold in natural ways, so much in fact, that you may in fact believe there is this Cube were people try to escape, or in the case of NOTHING, a large empty expanse where there is... nothing! The advert had me hooked instantly. It seemed so simple! Take two characters who no one likes, and send them to a world where there is nothing. Natali does this so simply that you forget the logic that a place where there is nothing cannot exist. In fact, the world of nothing becomes something of an irony within the film. There's nothing there, but also 'something' there.<br /><br />It might be a good time to point out that the trailer is highly misleading. I was fortunate enough to actually understand that the film leaned to a more comedic side than the trailer otherwise told so. Therefore upon watching the film, i laughed every now and again, whereas someone who the advert mislead may find themselves utterly confused.<br /><br />If i may take a minute to give the film some praise, where the film excels on is the concept. It is a genius concept to have a world of nothing, and to put two characters there, NOT two brilliant minded characters, who will philosophise and work out their surroundings, but two idiots who have absolutely no clue as to where the hell they are! Another strong point is the film's cinematography, though at first this may not seem it! Where each wall, north, earth, south, west, up and down is just a white plane, a perception of depth becomes faulty. It is hard to determine where things are placed in the Mis-En-Scene. The cinematography has many moments where this actually happens, but for the most part, the camera is placed so that two characters, or an object and a character are placed in the foreground and background, allowing a sense of depth to be realised.<br /><br />However, this film does lack in certain areas. The film is relatively short, but even so, after a while the novelty of this world of nothing becomes rather dull, and you wish to find some form of resolution within the plot. We can also argue that the acting is once again, questionable. These two characters are in a sense, unlikeable, therefore we feel no sympathy at any point for these characters. However, on a flip side of that, the chemistry and friendship between the two characters seems real enough, but there is something lacking.<br /><br />Even so, i do rank this as a thoroughly enjoyable film! Do not let the trailer fool you into thinking this is another science-fiction horror film. It is much more of a comedy than that! It is indeed worth watching though, purely for the concept itself!",pos
"I enjoyed the innocence of this film and how the characters had to deal with the reality of having a powerful animal in their midst. The gorilla looks just terrific, and the eyes were especially lifelike. It's even a little scary at times and should have children slightly frightened without going over the top. Rene Russo plays her role wonderfully feminine. Usually these type of Hollywood films that take place in the past feel the need to create a straw-man villain but the only adversary is the gorilla. It's an interesting look at how close some animals are to humans, how they feel the same emotions we do, and yet how we really can't treat them just like people because they aren't. Not many films venture into this territory and it's worth seeing if you want to contemplate the human-animal similarity.",pos
"A really sweet movie that has some similarities to the 2001-hit ""My Sassy Girl"" but is able to enchant most of the time. The biggest applause should go to the two leads. Ha-Neul Kim is both sweet and quirky, Sang-woo Kwon is both attractive and rebellious. The chemistry between the two is very good.<br /><br />Director Kyeong-hyeong Kim uses some CG-inserts to pepper up the visuals and also offers impressive fight scenes in which Sang-woo Kwon can shine. I liked him a lot better here than in the highly overrated ""Volcano High"". And that boy has a future - those looks, those fight techniques, and a romantic lead. Not bad.<br /><br />Well, I can make it short: Nice film. My rating: 7/10",pos
"Yeah, the poster is quite a horrible piece of work.<br /><br />I thought the movie was OK...nothing really outstanding...I just was hoping that he would be a hardcore druggie and totally trash his life.<br /><br />Ahh, but that can't happen to rich kids now can it? Not to the son of a wealthy businessman who holds big ballroom parties and has a nice manicured lawn on the front of the mini mansion.<br /><br />No...the kid is too good to have his life totally trashed. After all, who will drive the brand new SUV and who will go to law school? <br /><br />Ah, the poor little rich kids...in their quaint pretty house, with their ivy league schools, ultra clean homes and socialite parties...what will the world do without them? <br /><br />I hope they all get addicted to drugs, pass-away their life and end up in jail...so maybe we can see movies that don't all revolve around the poor little rich boys and girls of the surreal world.",pos
"Somewhat too long and going over the top towards the end, this comedy is an utterly delightful, never condescending or ridiculing look into the problems of a ""power man"", who likes to wear women´s clothes at nite.<br /><br />Julie Walters is lovely as always, but Adrian Pasdar is utterly credible and steals the film. He (she)is absolutely gorgeous in high heels and silk stockings.",pos
"Cannot believe my eyes when read quite a bunch of other comments and reviews. As if it were a mediocre movie of some run-of-the-mill dudes.<br /><br />The movie is great, funny, crazy, over-the-top violent though with minimum gore, and all the way energetic to the core. Loved every single bit of it. Can't remember anything insane like this made for laughs and martial art showing off. And now the most important thing (at least to me): it is computer effects free. When I watch some Hollywood actors duking it out on screen in modern high-resolution and damn high-budgeted action ""fuflo"" (a Russian word that means ""bull*beep*""), I understand that any *beep* child can do it - you can adjust the wires to the body, add some cute PC effects, and stuff it into the action film. Here it is different. I don't think that there will be even a dozen of physically advanced action stars worldwide, who can repeat the brawl that takes place at the end of the film or the ""Chinese football"" play. And it is just a little Hong Kong cinema made for fun, not pretending to be ""Star Wars"".<br /><br />Having a DVD with English soundtrack is not a problem with this movie. It does not spoil the atmosphere to me.<br /><br />Can't help mentioning a very neat theatrical play. Some of you, suppose, won't like it. As to me - it's amazing. Have a look at the Dragon's friend who is talking in a brave manner to the criminals and all of a sudden gets a fist punch in his left side of the head. His face expression changes into something whimsical and he comes up to Dragon with a baby expression. And take a look at the menacing size of his mouth - it's nearly from one ear to the other long when he makes grimaces.<br /><br />This movie deserves a higher rating and a thousand comments from people all over the world. Very thankful to our Russian industry for the releases of classic Jackie Chan movies. His modern ones are much weaker in my humble opinion and do not deserve much hype.<br /><br />Total 10 out of 10 - a legendary movie in its genre. Thank you for attention.",pos
"I remember first watching Sabrina when it came to TV in the UK on ITV1 when i was 13/14. I'm now 24 and still love it now as much as i did when i first watched it. I get a little stick from some of my friends for still watching a ""kids show"" but i don't care! lol Caroline Rhea as ""Hilda"" is my personal favourite character and Later on Morgan also became another of my favourite characters. I remember spending so much time watching various special events honouring Sabrina on the TV station Nickeleoden UK. I love Mellissa Joan-Hart, she was great in ""Clarrissa Explains All"" but so much better in this. I was gutted when they decided to finish it! I hope it will soon be released on DVD here in the UK - I'll be first in line! lol x",pos
"When I first saw this movie, the first thing I thought was this movie was more like an anime than a movie. The reason is because it involves vampires doing incredible stunts. The stunts are very much like the Matrix moves like the moving too fast for bullets kinda thing and the jumping around very far. Another reason why I the movie is good is because the adorable anime faces they do during the movie. The way Gackt does his pouting faces or just the way they act, VERY ANIME. I think that it's a really good movie to watch. ^_^ The action in this movie is a 10 (not to mention Gackt and Hyde too are a 10). ^_~ If you are Gackt and Hyde fans, you have to see it.",pos
"This is one of the creepiest, scariest and most heartbreaking horror movie EVER! <br /><br />Dr Creed (Louise) and his family moving in to new home with his wife (Rachel), Daughter (Ellie) and little son (Gage) Everything seems normal until Dr Creed loses one his patient who had a terrible head injury,Then he is haunted by the ghost know as Victor takes him to the Pet Sematarty and show him that where the dead come to life.<br /><br />Louis not knowing if that was all dream and is talking to Ellie who worried about her cat that could be killed by lorry and then later on Rachel tells Louis that it really hard for to talk about death because of her sister Zelda who was really sick (As we see in a flashback how sick her sister really was and this is one of the most creepiest scene ever!) <br /><br />The next day Louis gets a call from Jed saying there cat as been killed by lorry and Jed take him to place where Victor the Ghost told him not to go! And bury the Cat, His wife and kids have go to see their Grandparents and Louise is home alone shocked to see the cat is back and now it as evil in it eyes so he goes to see Jed then Jed tell him that he also buried his dog there too (As we seen other flashback).<br /><br />Later on in the movie The Family out having Picnic, Gage is playing with kite and Gage say's I drop it"", The wind blow the rod near the road where a lorry coming at fast past, Gage is get closer to road, Louis is rushing to get him, The most HEARTBREAKING scene in any horror movie will leave with your Jaw on floor or Shivers will go down your back when you hear Louis screams, Soon he missing him so much, Louis then buries Gage in same place where is buried the Cat. <br /><br />The scariest thing about this movie is that some scenes in this movie are not too far from really life. <br /><br />This movie is just Amazing and the acting from everyone was great! 10 out 10",pos
