text,label
"Acute hemorrhagic edema of infancy (AHEI)--a variant of Henoch-Schonlein purpura or a distinct clinical entity? Acute hemorrhagic edema of infancy (AHEI) is an acute cutaneous leukocytoclastic vasculitis (LCV) of infants. The clinical picture has a violent onset with a short benign course followed by spontaneous complete recovery. We report 12 infants with AHEI who were studied clinically, serologically, and immunohistologically. Edema and palpable purpuric skin lesions were present in all infants who were in good general condition. Serologic studies were unremarkable. Light microscopic examination of the skin biopsy specimens revealed LCV as in Henoch-Schonlein purpura (HSP). Direct immunofluorescent study revealed depositions of various immunoreactants, including fibrinogen, C3, IgG, IgM, IgA, and IgE (100%, 100%, 22%, 78%, 33%, and 33%, respectively) in the wall and around the small vessels. Similar deposition of Clq was also present in three infants in whom Clq could be studied (100%). The clinical similarities and differences between AHEI and HSP have been discussed in the literature. AHEI is observed before 2 years of age and is confined to the skin. The skin lesions of HSP are more polymorphic. Although histopathologic findings are similar, the immunohistologic pattern found in our series of AHEI is rather different from the pattern of HSP. Taking all of these findings into account, we suggest that AHEI should be considered as a separate, clinicopathologic entity or a possible variant of HSP. The more descriptive term ""acute benign cutaneous LCV of infancy"" is offered for this clinicopathologic entity. ",4
"Hepatic venoocclusive disease in autologous bone marrow transplantation of solid tumors and lymphomas. Retrospective review of 291 solid tumor and lymphoma patients undergoing autologous bone marrow transplantation (BMT) was performed to determine the influence of pretransplant characteristics and preparative regimen to the development of hepatic venoocclusive disease (VOD). Twelve patients (4.1%) developed a clinical syndrome of right upper quadrant (RUQ) tenderness or hepatomegaly, jaundice, and ascites, with or without encephalopathy, within 40 days of marrow reinfusion. Evidence of metastatic liver disease was the only pretransplant characteristic predictive for VOD (P = .0002). Sex, age, histology, hepatitis B serology, and elevated liver function tests were not predictive. No individual preparative agent had a significant effect on the development of VOD. However, a single 2-hour infusion of carmustine (BCNU) (greater than or equal to 450 mg/m2) led to an increased incidence of VOD when compared with the same dose administered in a fractionated schedule (P = .0258) when given with two other chemotherapeutic agents. Seven of eight autopsy specimens confirmed the clinical diagnosis of VOD. The four patients in whom clinical VOD resolved had lower median peak bilirubins (7.3 v 15.9 mg/dL), lower median peak creatinines (2.1 v 4.1 mg/dL), and relatively quick engraftment of neutrophils (mean, 18.7 days). One of the four patients in whom VOD resolved had other grade 4 (life-threatening) toxicities in contrast to eight of eight who succumbed. In summary, VOD is an uncommon complication in autotransplantation of solid tumors and lymphomas. Our data suggest caution in selecting patients with known metastatic liver disease and consideration of a fractionated BCNU schedule especially in combination with other alkylating agents. ",2
"The occurrence of motor fluctuations in parkinsonian patients treated long term with levodopa: role of early treatment and disease progression. The aim of this study is to evaluate what factors influence the risk of occurrence of motor fluctuations in patients with Parkinson's disease (PD) with particular reference to the role of early or delayed introduction of levodopa therapy during the course of the disease. One hundred twenty-five consecutive newly diagnosed patients with PD started levodopa treatment at the time diagnosis and were followed for 2 to 10 years. During follow-up, 60 patients had wearing-off or early morning akinesia. We estimated the cumulative time-dependent risk of motor fluctuation occurrence through a multivariable analysis. The risk was lower for patients with tremor-predominant PD, for those with shorter disease duration prior to levodopa, and for those who were relatively older at levodopa initiation. Our results suggest that, as far as motor fluctuations are concerned, disease prognosis is not influenced by early levodopa treatment. These observation support the introduction of levodopa as soon as there is a subjective need for the patients to maintain their level of social and work performance. ",3
"Toxic shock syndrome after inguinal hernia repair. Report of a case with patient survival. A 40-year-old man developed fulminant multisystem failure several days after elective repair of an inguinal hernia. Toxic shock syndrome (TSS) was diagnosed. There was, however, no evidence of wound infection at the time of multisystem failure. Only later in his hospital course did the wound drain. Staphylococcus aureus was cultured from the wound and was the presumed etiologic agent in the patient's life-threatening illness. The patient recovered fully with supportive care, antibiotics, and surgical debridement of the inguinal hernia site. This case is discussed in the context of existing literature on the toxic shock syndrome. The site of infection is typically nonsuppurative, but the systemic manifestations are typically life threatening. The responsible organism is commonly believed to be a strain of S. aureus that expresses a toxin (TSS toxin-1) that effects multisystem failure, but which also diminishes the local inflammatory response and explains the benign appearance of the wound. Although this is a rare clinical entity, elective surgical procedures complicated by fatal TSS have been reported. Surgeons should understand this disease and the management necessary to avert mortality. ",2
"Comparison of ulcer surgery at a Veterans Administration and University Hospital. We compared the patient populations and outcome of surgery for peptic ulcer disease in 81 patients at a Veterans Administration Hospital (OVAH) and 97 patients at an affiliated University Hospital (UNH). The surgeons and choice of operation were comparable at both facilities. Patients were similar with respect to severity of ulcer disease, percentage of elderly patients and distribution of comorbid conditions. There were significantly more female patients (45% vs 2%, P less than 0.05), patients less than 40 years old (22% vs 6%, P less than 0.05), and patients with gastric ulcers (27% vs 12%, P less than 0.05) at UNH. Alcoholism was more prevalent at OVAH (57% vs 22%, P less than 0.05). Postoperative morbidity and mortality rates were 27 per cent and 14 per cent at OVAH and 25 per cent and 16 per cent at UNH. These data suggest that quality of care for surgical therapy of ulcer disease at a VA Hospital is comparable to its tertiary care affiliate with a similar patient population. ",2
"Helicobacter pylori and associated duodenal ulcer. Twenty three children with coexistent duodenal ulcer and Helicobacter pylori infection were treated with either two weeks of amoxycillin (25 mg/kg/day) in addition to six weeks of cimetidine, or cimetidine alone. Endoscopy with antral and duodenal biopsies for urease test, microaerophilic culture, and histological studies were performed at entry, six weeks, 12 weeks, and at six months. Children with persistent H pylori infection at six weeks were given a further two weeks' course of amoxycillin. H pylori persisted in all children not receiving amoxycillin treatment but cleared in six of the 13 children (46%) treated with amoxycillin. With failure of H pylori clearance at six months, only two out of six (33%) ulcers had healed and 50% of patients had experienced ulcer recurrence. In contrast, when H pylori remained cleared all ulcers healed and no ulcer recurred. Persistent H pylori infection was associated with persistent gastritis and duodenitis despite endoscopic evidence of ulcer healing. Detection and eradication of H pylori deserves particular attention in the routine management of duodenal ulceration in children. ",2
"Diagnosis and prevalence of persistent chlamydia infection in infertile women: tissue culture, direct antigen detection, and serology. Specimens for chlamydial culture, direct fluorescent antibody (DFA) test, two enzyme immunoassays (EIA) for antigen detection, and serum for chlamydial antibodies were collected from 256 infertile women. Specimens were taken from the tubes during tuboplasty and from the cervix and endometrium during laparoscopy or tuboplasty. Antibodies to Chlamydia trachomatis were found four times more often in patients with signs of prior pelvic inflammatory disease (PID) than in infertile women with normal pelvic findings. Only 48 (37%) of 131 patients with signs of prior PID had a history of PID. Ten or more C. trachomatis elementary bodies (EBs) per smear were found in 21 (8.2%) of 256 patients. Six patients had a positive culture or a positive antigen EIA test. All six had high numbers of EBs in the DFA test. We conclude that routine culture and EIA antigen tests detect only a minority of persistent chlamydia infections in this population, but subjective factors in the interpretation of DFA methods must be considered. ",5
"Late rupture of a superior intercostal artery following repair of aortic coarctation. Having had surgical repair of aortic coarctation at the age of 12 years, and re-operation at the age of 19 years for stenosis at the site of the previous repair, a 29 years old man presented as an emergency with a 24 hour history of interscapular pain, haemoptysis and collapse. At thoracotomy he was found to have a ruptured superior intercostal artery which was ligated. Spontaneous rupture of an intercostal artery has not been previously recorded. ",4
"Syringomyelia secondary to compression of the cervical spinal cord by an extramedullary lymphoma. A case of syringomyelia secondary to an extramedullary cervical spinal cord compression by a non-Hodgkin's lymphoma is described. After radiotherapy, the syrinx was no longer seen. The pathogenesis of this type of syrinx is discussed, and the potential benefit of radiotherapy in these cases is suggested. ",3
"A phase I trial of cisplatin in hypertonic saline and escalating doses of 5-fluorouracil by continuous intravenous infusion in patients with advanced malignancies. Thirty-four patients with incurable solid tumors were treated in a Phase I trial with a fixed dose of high-dose cisplatin (CDDP) administered in hypertonic saline and escalating doses of infusional 5-fluorouracil (5-FU). Five treatment levels of 5-FU, ranging from 500 to 900 mg/m2/day for 5 days, were studied. Leukopenia, thrombocytopenia, and oral mucositis were the dose-limiting toxicities encountered. Nephrotoxicity was minimal. Ototoxicity and peripheral neuropathies were rare and mild in this patient group, but most patients received only a small number of treatment cycles. Diarrhea was not dose-limiting. Two complete responses (one non-small cell lung cancer and one sweat gland carcinoma) were observed. No other major responses were noted. With the dose of CDDP set at 35 mg/m2/day for 5 consecutive days, the maximum tolerated dose (MTD) of a concurrent 5-day 5-FU infusion was found to be 900 mg/m2/day. The recommended dosages for Phase II trials are 35 mg/m2/day CDDP and 800 mg/m2/day 5-FU for 5 consecutive days. Cancers of the lung, breast, gastrointestinal tract, and genitourinary tract would be reasonable targets for Phase II studies. ",1
"Giant-cell arteritis of the uterus with associated temporal arteritis: a case report. Giant-cell arteritis involving the uterus was identified incidentally upon hysterectomy and anterior colporrhaphy for uterine prolapse. Subsequently, the patient was found to have giant-cell temporal arteritis presenting with fever of unknown origin. Fourteen previous cases involving the female genital tract have been reported. There appears to be an association between constitutional symptoms of fever, weight loss, malaise, headache, and polymyalgia rheumatica in elderly women with uterine prolapse and giant-cell arteritis of the genital tract. The rare presentation of giant-cell arteritis in the female genital tract does not support invasive costly evaluation in asymptomatic patients. However, a thorough investigation for involvement of other sites, including appropriate treatment for generalized disease, should be undertaken. ",4
Platelet norepinephrine and epinephrine concentration in patients with pheochromocytoma. Platelet and plasma catecholamine concentrations were determined in 17 patients with surgically proven pheochromocytoma (mean age 42.3 years); in 31 patients with borderline hypertension (mean age 35.3 years) and in 9 healthy controls (mean age 39.3 years). Both platelet norepinephrine and epinephrine were significantly increased in patients with pheochromocytoma when compared with hypertensive and control groups (P less than .001). No correlation between platelet and plasma catecholamines was detected in all studied groups. The diagnostic accuracy of platelet catecholamine in pheochromocytoma is limited since increased platelet norepinephrine was found in 35.5% and increased platelet epinephrine was found in 19.4% of patients with essential hypertension. ,4
"Mutations in the K-ras oncogene induced by 1,2-dimethylhydrazine in preneoplastic and neoplastic rat colonic mucosa. These experiments were conducted to determine whether point mutations activating K-ras or H-ras oncogenes, induced by the procarcinogen 1,2-dimethylhydrazine (DMH), were detectable in preneoplastic or neoplastic rat colonic mucosa. Rats were injected weekly with diluent or DMH at 20 mg/kg body wt for 5, 10, 15, or 25 wk, killed, and their colons dissected. DNA was extracted from diluent-injected control animals, histologically normal colonic mucosa from carcinogen-treated animals, and from carcinomas. Ras mutations were characterized by differential hybridization using allele-specific oligonucleotide probes to polymerase chain reaction--amplified DNA, and confirmed by DNA sequencing. While no H-ras mutations were detectable in any group, K-ras (G to A) mutations were found in 66% of DMH-induced colon carcinomas. These mutations were at the second nucleotide of codons 12 or 13 or the first nucleotide of codon 59 of the K-ras gene. The same type of K-ras mutations were observed in premalignant colonic mucosa from 2 out of 11 rats as early as 15 wk after beginning carcinogen injections when no dysplasia, adenomas, or carcinomas were histologically evident, suggesting that ras mutation may be an early event in colon carcinogenesis. ",1
"Ultrasonic integrated backscatter two-dimensional imaging: evaluation of M-mode guided acquisition and immediate analysis in 55 consecutive patients. We have shown previously that cardiac cycle-dependent integrated backscatter characterizes the physical state of myocardium in patients with ischemic heart disease and cardiomyopathy. In the present study the clinical applicability of M-mode guided two-dimensional integrated backscatter imaging was defined in evaluation of 55 nonselected patients. The mean amplitude of cyclic variation of integrated backscatter in normal segments (long-axis view) was as follows: basal septum, 4.2 +/- 1.3 dB (mean +/- SD; n = 27), mid-septum, 4.5 +/- 1.0 dB (n = 26), basal posterior, 4.8 +/- 1.0 dB (n = 30), and mid-posterior, 4.8 +/- 1.2 decibels (n = 27). The respective mean delay values (R wave to nadir) were as follows: 0.89 +/- 0.09, 0.84 +/- 0.09, 0.86 +/- 0.09, and 0.85 +/- 0.12. At least one cardiac cycle could be analyzed fully in 62% of patients. Limitations included technically difficult two-dimensional echocardiography, inadequate M-line orientation, technically remediable errors, or poor quality integrated backscatter images. In abnormal segments (n = 13) cyclic variation was reduced and delay was prolonged (1.2 +/- 1.1 dB and 1.21 +/- 1.1, respectively). Intraobserver and interobserver variability for amplitude measurements were modest, with respective correlation coefficients of r = 0.93; r = 0.72. The findings demonstrate that M-mode--assisted integrated backscatter is a practical approach for characterization of regional myocardial properties promptly and at the bedside in a large portion of patients with cardiac disease. ",4
"Monoclonal antibody B72.3 in benign breast lesions. It has been suggested that the monoclonal antibody B72.3 may be useful as a diagnostic tool in fine needle aspirates of breast masses because it recognises ""tumour associated glycoprotein (TAG)-72"". The antigen was sought in paraffin wax sections of 43 normal and benign breast biopsy specimens, using the avidin-biotin complex technique, to assess the extent of its presence in non-malignant tissue. Strong focal staining was seen in 21 (49%) cases. In 29 cases of fibrocystic change staining was present in 17 (59%). All areas of apocrine metaplasia were positive, as well as a few normal ducts and acini and occasional areas of adenosis. Focal positivity was present in five out of 12 foci of ductal epithelial hyperplasia and in three out of seven radial scars. Staining was absent in two areas of lobular hyperplasia, three areas of sclerosing adenosis, and in a focus of lactational change. Focal positivity was also seen in two out of five fibroadenomas and in two out of three intraduct papillomas. Five normal subareolar sections and a section of normal lactating breast were negative. It is concluded that B72.3 monoclonal antibody can show focal reactivity with a variety of normal and benign epithelial mammary structures, and it is doubtful that its use would be of any help in differentiating benign from malignant cells in fine needle aspirates. ",1
"Radical vulvectomy with partial rectal resection and temporary colostomy as primary therapy for selected patients with vulvar carcinoma. The patient with carcinoma of the vulva may present with tumor involvement of the perirectal area. Traditional treatment has often involved ultraradical therapy including a radical vulvectomy with posterior or total pelvic exenteration in an effort to obtain adequate surgical margins. Five-year survival rates for these patients range from 20-50%, and major operative morbidity as well as psychological problems are associated with this extensive surgery. Five patients treated for a locally advanced vulvar carcinoma involving the perirectal area were thought to be candidates for a rectum-sparing procedure. They underwent a radical vulvectomy, bilateral inguinal lymphadenectomy, partial rectal resection, and a diverting colostomy. Four of the five patients agreed to a colostomy closure 6 months after their primary therapy; these four patients have resumed normal bowel function. All patients remain clinically free of tumor. ",1
"Tissue distribution of 2-3 and 2-6 sialyl Lewis A antigens and significance of the ratio of two antigens for the differential diagnosis of malignant and benign disorders of the digestive tract. The authors investigated the tissue distribution of two kinds of sialylated derivatives of Lewis A (Le(a)) antigen in patients with cancers of the digestive system using specific monoclonal antibodies, and evaluated the significance of determining the 2-3 and 2-6 sialylated Le(a) antigen levels for the diagnosis of cancer. In most specimens from patients with cancers of the pancreas, biliary tract, stomach, and colon, the 2-3 sialylated Le(a) antigen was strongly expressed in cancer cells. However, 2-6 sialylated Le(a) antigen was less frequently expressed in cancer cells. The former is therefore more specific to cancer than the latter. Also, the serum level of the 2-3 sialylated Le(a) antigen was significantly higher than that of the 2-6 counterpart in patients with cancers of pancreas, biliary tract, stomach, and colon. The resulting ratio of serum 2-3/2-6 sialylated Le(a) antigens was frequently high in patients with malignancy and was low in patients with benign disorders of these digestive organs. Therefore, the 2-3/2-6 sialylated Le(a) antigen ratio is a useful for the differential diagnosis of malignant disorders in these organs. However, liver disorders were found to be exceptional in that both antigens were mostly absent in hepatocellular carcinoma (HCC) cells in immunohistologic examination, as well as in nonmalignant parenchymal liver cells. Only the epithelial cells of the intrahepatic bile ducts expressed the 2-6 sialylated Le(a) antigen strongly, and expressed the 2-3 sialylated Le(a) antigen moderately. The levels of both antigens were sometimes high in patients with liver disorders, but the ratio always remained low in patients with HCC as well as benign liver disorders such as cirrhosis or chronic hepatitis. The sialylated Le(a) antigens, which sometimes accumulate in the sera of patients with HCC, were concluded to originate from the epithelial cells of the proliferating small bile ducts, and those serum antigens cannot be considered as evidence for the presence of liver cancer cells. ",2
"Scintigraphic measurement of oropharyngeal transit in man. Scintigraphic studies of the oropharyngeal transit of a liquid bolus were performed in 15 healthy controls, 12 patients with symptoms of oral-pharyngeal dysphagia, and 13 patients with neuromuscular disease, who did not have dysphagia. Gamma camera imaging of the head, neck, and upper thorax was undertaken, in the lateral projection, during the swallowing of the radiolabeled bolus of water. Inspection of summed images permitted the selection of regions of interest (ROI) to represent the mouth, pharynx, and upper esophagus. Transit times between each ROI were calculated and compared. Significant prolongation of bolus transit time between the mouth and esophagus was present in both patients with and without dysphagia (0.59 +/- 0.38 sec and 0.33 +/- 0.7 sec; mean +/- SD, respectively) compared with controls (0.26 +/- 0.04 sec P less than 0.001, P less than 0.01, respectively, Mann-Whitney U test). Repeat studies in 25 individuals indicated that the transit measurements were more reproducible between swallows in normal subjects than in patients with symptoms. Deglutitive scintigraphy provides a noninvasive technique for the quantitative study of swallowing and its disorders. ",3
"Penetration of lanthanum through the main pancreatic duct epithelium in cats following exposure to infected human bile. The main pancreatic duct epithelium acts as a barrier to the diffusion of molecules from the duct lumen into pancreatic acinar and interstitial tissue. We studied sequential ultrastructural characteristics of the loss of epithelial barrier function in the cat using lanthanum, an electron-opaque tracer, following perfusion of the duct from the tail to the duodenum with infected human bile. Tight junctions between duct epithelial cells were found to become permeable to the tracer as early as after 15 min of exposure. Later, there was progressive disintegration of intercellular junctions and epithelial loss. Lanthanum penetrated the duct epithelium exclusively on an intercellular path. Loss of barrier function of the pancreatic duct epithelium was consistently associated with subsequent development of acute interstitial edematous pancreatitis. There was no association between the degree of duct epithelial damage and the severity of acute pancreatitis. Both bile and a suspension of bacteria alone were not harmful to the pancreas. Sequential perfusion produced acute pancreatitis only when at first bile and then the bacterial suspension was perfused. A reversed succession of perfusates produced no morphologic alterations. We conclude: (1) Increased tight junction permeability is an early lesion in acute bile-induced pancreatitis: (2) loss of duct epithelial barrier function is important for the initiation but not for the severity of the inflammation; and (3) bile renders duct epithelial intercellular junctions vulnerable to Escherichia coli bacteria. ",2
