text,label
"Primary defect in alpha-adrenergic responsiveness in patients with varicose veins. Responsiveness of superficial hand veins to local infusions of noradrenaline was compared in patients with primary varicose veins and in healthy volunteers by use of the dorsal hand vein technique. Patients with varicose veins required significantly higher doses of noradrenaline for half-maximal venoconstriction than the dose required by control subjects (geometric mean, 11.6 ng/min in patients compared with 4.8 ng/min in control subjects; p = 0.006). Noradrenaline responsiveness in varicose veins was not significantly different from hand vein responsiveness in the same patients. Our findings indicate a constitutional decrease in venous alpha-adrenergic receptor responsiveness in patients with varicosities. Dilation of varicose veins does not further affect noradrenaline-induced venoconstriction. ",4
"Use of a computerized closed-loop sodium nitroprusside titration system for antihypertensive treatment after open heart surgery. This study evaluates the clinical applicability of administering sodium nitroprusside by a closed-loop titration system compared with a manually adjusted system. The mean arterial pressure (MAP) was registered every 10 and 30 sec during the first 150 min after open heart surgery in 20 patients (group 1: computer regulation) and in ten patients (group 2: manual regulation). The results (16,343 and 2,912 data points in groups 1 and 2, respectively), were then analyzed in four time frames and five pressure ranges to indicate clinical efficacy. Sixty percent of the measured MAP in both groups was within the desired +/- 10% during the first 10 min. Thereafter until the end of observation, the MAP was maintained within +/- 10% of the desired set-point 90% of the time in group 1 vs. 60% of the time in group 2. One percent and 11% of data points were +/- 20% from the set-point in groups 1 and 2, respectively (p less than .05, chi-square test). The computer-assisted therapy provided better control of MAP, was safe to use, and helped to reduce nursing demands. ",4
"Extensive peripheral retinectomy combined with posterior 360 degrees retinotomy for retinal reattachment in advanced proliferative vitreoretinopathy cases. Posterior 360 degrees retinotomy in conjunction with extensive peripheral retinectomy was necessary for retinal reattachment in 18 eyes. A visual acuity of 20/400 or better was achieved in 22% of the patients; in patients with rubeosis, regression was found in 89%. Of the hypotonus eyes, preoperatively 78% were normotensive postoperatively after removal of anterior proliferative vitreoretinopathy (PVR) covering ciliary epithelium. The major intraoperative complication was hemorrhage, which could be readily controlled. Recurrent retinal detachment (RD) occurred in 39% and reproliferation in 50% of the patients. ",5
"Natural history of progressive ischemic stroke in a population treated with heparin Data on the acute natural history of progressive stroke with or without heparin treatment are limited. To define the acute course of patients treated with heparin for progressive stroke, we examined the charts of 69 such patients identified through the Cornell Neurology Database from October 1979 to June 1985. Analysis included determining whether further clinical deterioration or hemorrhagic complications were associated with readily identifiable clinical or laboratory variables. Twenty-five patients (36%) continued to deteriorate while receiving heparin, another two (3%) worsened due to intracerebral hemorrhage, and a total of 10 patients (14%) had bleeding complications. No clinical features or heparin dosing regimens distinguished the patients likely to benefit from heparin. Clinical progression or hemorrhage did not correlate with the level of anticoagulation as measured by the average heparin dose per day or the mean partial thromboplastin time. Without unequivocal evidence demonstrating heparin's ineffectiveness for progressive stroke, many clinicians managing such patients will continue to use heparin. Our results suggest that this decision should not be governed by such clinical features as a patient's age or sex or by the vascular distribution of the stroke. Furthermore, frequent measurement of and overzealous efforts to adjust the partial thromboplastin time may be unnecessary since it does not correlate with outcome. ",3
"Clinical and manometric aspects of diffuse esophageal spasm in a cohort of subjects evaluated for dysphagia and/or chest pain. Manometric criteria for diffuse esophageal spasm have recently been restated. In this study, a cohort of 358 subjects was evaluated in a gastrointestinal motility laboratory for dysphagia and/or chest pain. Applying the recently proposed criteria of Richter and Castell, 18 subjects (5%) were diagnosed as having DES. Dysphagia was the major complaint (89%), while 44% of patients complained of chest pain and 33% of both symptoms. All patients shared more than 30% simultaneous contractions after wet swallows interspersed with normal peristaltic sequences. Associated manometric findings were repetitive (greater than 3 peaks) contractions (67%), high-amplitude contractions (33%), spontaneous activity (22%), prolonged duration (11%), and lower esophageal sphincter abnormalities (5%). Radiology disclosed significant abnormalities in only 27% of DES patients. ",2
"A blood-liquid interface for prolonged extracorporeal oxygenation with excellent antithrombogenicity. The authors verified the excellent antithrombogenicity of a blood-liquid interface (BLI) and introduced an oxygenator based on the principle of gas exchange across direct BLI. In a newly developed oxygenator, three layers of liquid flowed horizontally, contacting one another: O2 saturated silicone oil on the top, O2 saturated fluorcarbon at the bottom, and blood in the middle. Gas exchange was carried out across both direct BLIs. This system provided excellent antithrombogenicity as well as good gas exchange. The results indicate that this method will become a promising modality for prolonged extracorporeal oxygenation. ",4
"Fetal choroid plexus cysts: a prospective study and review of the literature. To determine the incidence and significance of fetal choroid plexus cysts, a prospective study was carried out at Queen's Medical Centre, Nottingham. The incidence of cysts was found to be 0.42% and the size of cysts varied from 3 to 13 mm with a mean diameter of 6.2 mm. Choroid plexus cysts were associated with other fetal abnormalities in three cases, two of which were subsequently found to have a chromosomal abnormality, one Trisomy 18 and one Trisomy 21. A review of the reported cases of choroid plexus cysts reveals an overall incidence of 5.8% for Trisomy 18. We therefore recommend that in patients with choroid plexus cysts a detailed scan should be carried out to look for the ultrasound markers of Trisomy 18. If there is an associated abnormality or cysts are large (13 mm or greater in diameter) and bilateral then a karyotyping should be carried out. ",3
"The influence of warning signal timing and cognitive preparation on the aversiveness of electric shock. Many medical and dental procedures are noxious. Finding an optimal way of warning patients concerning the aversive procedures could help them to cope better. A model for the effective use of a warning signal in coping with pain posited that a person needs enough time to be able to react and should possess the skills necessary to utilize the time effectively. It was felt that a very short warning period, e.g., 5 sec, could not be long enough, while a 180 sec warning period would in and of itself become aversive. Reactions to electric shock were obtained from 36 paid, volunteer subjects who were each tested on a within-subject, counterbalanced order at 4 different warning periods: 5, 30, 60, and 180 sec. The subjects were divided into 3 groups: (1) the experimental group was provided with a pretested self-instructional booklet to learn a variety of pain control techniques; (2) the placebo group was provided with a self-instructional booklet on citizenship; (3) the control group waited quietly for 13 min. No significant results were obtained for the different pain-coping conditions. Significant differences, however, were obtained for the various warning periods. Maximum skin resistance changes, higher ratings of pain and of anxiety were obtained for the 60 and 180 compared to the 5 and 30 sec warning periods. Maximum heart rate was obtained for the 30 sec warning. Results were discussed in terms of the psychological meaning of the various measures as well as their clinical implications. ",3
