text,label
Single-stage laryngotracheal reconstruction. The mainstay for repairing subglottic and tracheal stenosis has been the rib graft with prolonged stenting. A refinement of this treatment was the use of the anterior cricoid decompression (split). We present single-stage reconstruction of the airway as an additional refinement of the laryngotracheoplasty. This article describes the experience of two institutions with single-stage reconstruction and offers some observations on the principles of the technique. ,5
"Treatment of angiomas with sclerosing injection of hydroxypolyethoxydodecan. The authors discuss the indications for hydroxypolyethoxydodecan in the sclerosing treatment of angiomas, with particular reference to cavernous, venous, and evolutive angiomas (ie, immature angiomas that fail to involute by eight to ten months). Moreover, the sclerosing agent may be employed, in connection with embolization and subsequent surgery, in arteriovenous angiomas with a relevant cutaneous-subcutaneous development. The authors have successfully used the ""interstitial"" sclerosing technique, according to Andrews' method. This technique involves interstitial injections to obtain the sclerosis of the thin threads of fibrous tissue stroma between the blood vessels. The sclerosing therapy may cause the complete regression of ""low flow"" angiomas or, at least, a partial reduction that simplifies the ensuing surgical excision. In the case of partial regression of the angioma obtained with the sclerosing therapy, the surgery of the remaining angioma causes a lesser degree of bleeding (especially in areas that do not particularly lend themselves to surgical exploration, ie, the oral cavity); an increased reliability in the radicality of the intervention (due also to the reduced size of the lesion); and better results from an aesthetic-functional point of view. ",1
"Endoscopic palliative intubation of the esophagus invaded by lung cancer. Thirty-two patients with esophageal involvement by lung cancer were managed by endoscopic intubation. In 22 patients with extrinsic esophageal strictures, the success rate of intubation was 91%, and 82% were discharged with their dysphagia relieved and esophageal patency restored. The mean survival rate was 4.4 months. In 10 patients with esophago-bronchial fistulas, 3 had the fistulous tract obliterated and lived a mean of 5 months. This low success rate of closing fistulas is due to failure to seal off the space between the stent and the fistula because of absence of tumor-associated stenosis. The overall morbidity rate was 28.1% (18.8% perforation, 6.3% hemorrhage, and 3.1% tracheal obstruction). The overall mortality rate was 18.8%. Although complications were more frequent than in primary esophageal tumors, endoscopic intubation was the only way to palliate this desperate condition and provided 66.6% of patients with relief of symptoms, nutritional improvement, and a mean survival time of 4.5 months. ",2
"Prospective payment system and impairment at discharge. The 'quicker-and-sicker' story revisited Since the introduction of the prospective payment system (PPS), anecdotal evidence has accumulated that patients are leaving the hospital ""quicker and sicker."" We developed valid measures of discharge impairment and measured these levels in a nationally representative sample of patients with one of five conditions prior to and following the PPS implementation. Instability at discharge (important clinical problems usually first occurring prior to discharge) predicted the likelihood of postdischarge deaths. At 90 days postdischarge, 16% of patients discharged unstable were dead vs 10% of patients discharged stable. After the PPS introduction, instability increased primarily among patients discharged home. Prior to the PPS, 10% of patients discharged home were unstable; after the PPS was implemented, 15% were discharged unstable, a 43% relative change. Efforts to monitor the effect of this increase in discharge instability on health should be implemented. ",3
"Thallium reinjection after stress-redistribution imaging. Does 24-hour delayed imaging after reinjection enhance detection of viable myocardium? BACKGROUND. Thallium reinjection immediately after conventional stress-redistribution imaging improves the detection of viable myocardium, as many myocardial regions with apparently ""irreversible"" thallium defects on standard 3-4-hour redistribution images manifest enhanced thallium uptake after reinjection. Because the 10-minute period between reinjection and imaging may be too short, the present study was designed to determine whether 24-hour imaging after thallium reinjection provides additional information regarding myocardial viability beyond that obtained by imaging shortly after reinjection. METHODS AND RESULTS. We studied 50 patients with chronic stable coronary artery disease undergoing exercise thallium tomography, radionuclide angiography, and coronary arteriography. Immediately after the 3-4-hour redistribution images were obtained, 1 mCi thallium was injected at rest, and images were reacquired at 10 minutes and 24 hours after reinjection. The stress, redistribution, reinjection, and 24-hour images were then analyzed qualitatively and quantitatively. Of the 127 abnormal myocardial regions on the stress images, 55 had persistent defects on redistribution images by qualitative analysis, of which 25 (45%) demonstrated improved thallium uptake after reinjection. At the 24-hour study, 23 of the 25 regions (92%) with previously improved thallium uptake by reinjection showed no further improvement. Similarly, of the 30 regions determined to have irreversible defects after reinjection, 29 (97%) remained irreversible on 24-hour images. These findings were confirmed by the quantitative analysis. The mean normalized thallium activity in regions with enhanced thallium activity after reinjection increased from 57 +/- 13% on redistribution studies to 70 +/- 14% after reinjection but did not change at 24 hours (71 +/- 14%). In regions with irreversible defects that were unaltered by reinjection, mean regional thallium activity did not differ from the reinjection to the 24-hour studies (57 +/- 17% and 58 +/- 17%, respectively). Twenty-four-hour imaging after reinjection showed improvement in only four of 35 irreversible regions (involving three of the 50 patients). CONCLUSIONS. These data indicate that thallium reinjection at rest after 3-4 hours of redistribution provides most of the clinically relevant information pertaining to myocardial viability in regions with apparently irreversible thallium defects. Hence, thallium reinjection may be used instead of 24-hour imaging in most patients in whom a persistent thallium defect is observed on conventional redistribution images. ",4
"Disposition of 5-aminosalicylic acid by olsalazine and three mesalazine preparations in patients with ulcerative colitis: comparison of intraluminal colonic concentrations, serum values, and urinary excretion. To compare the disposition of 5-aminosalicylic acid (5-ASA) and its acetylated metabolite during treatment with olsalazine and mesalazine, 14 patients with inactive ulcerative colitis were randomly assigned to olsalazine (1 g twice daily) and the mesalazines, Asacol (800 + 400 + 800 mg daily), Pentasa (750 + 500 + 750 mg daily), and Salofalk (750 + 500 + 750 mg daily) in a crossover design trial so that all received each drug for seven days. Intraluminal colonic concentrations of 5-ASA were estimated after five days by the method of equilibrium in vivo dialysis of faeces. A predose serum sample and a 24 hour urine collection were obtained on day seven. The 5-ASA and acetyl-5-aminosalicylic acid (Ac-5-ASA) values were determined by high performance liquid chromatography. Olsalazine almost doubled the colonic concentrations (mean 23.7 (SEM) (1.9) mmol/l) of its therapeutically active ingredient (5-ASA) compared with equimolar doses of Pentasa (12.6 (2.2) mmol/l; p less than 0.0003) and Salofalk (15.0 (2.0) mmol/l; p less than 0.003). At the same time, olsalazine treatment was associated with lower serum concentrations and urinary excretions (p less than 0.05) of 5-ASA and Ac-5-ASA compared with the mesalazine preparations. The low systemic load of 5-ASA provided by olsalazine reduces the potential risk of nephrotoxicity during long term treatment. ",2
"Giant-cell arteritis of the uterus with associated temporal arteritis: a case report. Giant-cell arteritis involving the uterus was identified incidentally upon hysterectomy and anterior colporrhaphy for uterine prolapse. Subsequently, the patient was found to have giant-cell temporal arteritis presenting with fever of unknown origin. Fourteen previous cases involving the female genital tract have been reported. There appears to be an association between constitutional symptoms of fever, weight loss, malaise, headache, and polymyalgia rheumatica in elderly women with uterine prolapse and giant-cell arteritis of the genital tract. The rare presentation of giant-cell arteritis in the female genital tract does not support invasive costly evaluation in asymptomatic patients. However, a thorough investigation for involvement of other sites, including appropriate treatment for generalized disease, should be undertaken. ",4
"Gynecomastia. A bothersome but readily treatable problem. Although breast enlargement in boys and men can cause both psychological and physical distress, the disorder is rarely serious and is readily treatable. Several factors can lead to the estrogenic excess that causes growth of breast tissue. Dr Jacobs describes a patient with gynecomastia related to cirrhosis of the liver who responded promptly to a brief course of tamoxifen citrate therapy. ",2
"Complications of Tenckhoff catheters post removal. Complications due to Tenckhoff catheters can occur at prolonged intervals after their removal. From January 1979 to October 1989, 431 patients at our center began continuous ambulatory peritoneal dialysis (CAPD), 278 of whom subsequently transferred to another form of renal replacement therapy. We identified 12 patients (4.3% or 12/278) with post removal catheter complications. There were 14 post removal complications, two each in two patients, and one in each of 12 others. The mean time to complication was 541 +/- 143 days (27-2,040). In 71% (10/14) of the complications, an abscess was found at the site of the previously removed Tenckhoff catheter. In 29% (4/14) of the complications, foreign body material consistent with a retained cuff was recovered. Documentation at the time of Tenckhoff catheter removal should include a statement regarding the presence of the Tenckhoff catheter cuffs, and patients with retained cuffs should be monitored closely for the development of abscesses or other complications. Immunocompromised patients are at high risk for these complications. ",2
"Scoliosis in trisomy 18. Patients with trisomy 18 typically present with multiple congenital anomalies and most die within the first year. However, long-term survivors are not uncommon. Seventeen patients with trisomy 18 were evaluated to study the development of scoliosis associated with this disorder. There were 13 females and 4 males with ages ranging from birth to 22 years. Twelve patients died by age 2. None developed scoliosis or had vertebral anomalies. The five patients who survived beyond age 2 developed scoliosis. Curve progression was demonstrated in the patients who returned for follow-up. Bracing was not well tolerated in two patients with curves of 48 degrees and 58 degrees. Both had poor motor control and sitting ability. One patient with a 30 degree curve was successfully managed by bracing. Another patient with a severe scoliosis was successfully fused with anterior and posterior instrumentation. Patients with trisomy 18 should be carefully evaluated for scoliosis. Scoliosis in the older child, surviving beyond age 2, may be progressive and difficult to manage. ",5
"Sixty consecutive breast reconstructions with the inflatable expander: a critical appraisal. Breast reconstruction using inflatable expanders has become an established and preferred technique. Although our knowledge of the biomechanical changes occurring in expanded skin has increased greatly, little information is available regarding average aesthetic results achieved with this technique. In order to eliminate the bias of best case selection reports, this study of 60 consecutive patients undergoing skin-expansion breast reconstruction was undertaken. Results of the study demonstrated a significant frequency and diversity of complications. In particular, immediate breast reconstruction with skin expanders was identified as a high-risk procedure because of its association with skin necrosis and delayed wound healing. Although two procedures--insertion and replacement--had been anticipated, patients from both the Boston and New York groups required approximately three operations to complete the expansion process. Average aesthetic results, often characterized by problems of symmetry, ptosis, and contour, need to be recognized and improved. ",5
"Clinical, radiographic, and hemodynamic correlations in chronic congestive heart failure: conflicting results may lead to inappropriate care. PURPOSE: Clinical and radiographic examinations are commonly used for estimating severity and titrating therapy of chronic congestive heart failure. The purpose of this study was to establish the relationship between findings on history, physical examination, chest roentgenogram, and pulmonary capillary wedge pressure (PCWP). PATIENTS AND METHODS: Fifty-two consecutive patients with chronic congestive heart failure, referred for evaluation for heart transplantation, were studied; all patients underwent history, physical examination, upright chest roentgenogram, and cardiac catheterization. The mean left ventricular ejection fraction was 0.19 +/- 0.06. Patients were divided into three groups according to their PCWP: Group 1, normal PCWP (less than or equal to 15 mm Hg, n = 19); Group 2, mild to moderately elevated PCWP (16 to 29 mm Hg, n = 15); Group 3, markedly elevated PCWP (greater than or equal to 30 mm Hg, n = 18). RESULTS: Physical and radiographic signs of congestion were more common in the groups with higher PCWP, but they could not be used to reliably separate patients with different filling pressures. Physical findings (orthopnea, edema, rales, third heart sound, elevated jugular venous pressure) or radiographic signs (cardiomegaly, vascular redistribution, and interstitial and alveolar edema) had poor predictive value for identifying patients with PCWP values greater than or equal to 30 mm Hg. These findings had poor negative predictive value to exclude significantly elevated PCWP (greater than 20 mm Hg). Radiographic pulmonary congestion was absent in eight (53%) patients in Group 2 and seven (39%) in Group 3. In patients in Group 2 and 3, those without radiographic congestion were in a better New York Heart Association functional class (3.5 +/- 0.5 versus 2.8 +/- 0.6, p less than 0.01). There was good correlation between right atrial pressure and PCWP (r = 0.64, p less than 0.001). A normal right atrial pressure had no predictive value, but a pressure greater than 10 mm Hg was seen in all but one patient with a PCWP value greater than 20 mm Hg. CONCLUSION: Clinical, radiographic, and hemodynamic evaluations of chronic congestive heart failure yield conflicting results. Absence of radiographic or physical signs of congestion does not ensure normal PCWP values and may lead to inaccurate diagnosis and inadequate therapy. It is not known whether therapy aimed at normalizing PCWP is superior to relieving clinical and radiographic signs of congestion. ",5
"Association between neuroepithelial tumor and multiple intestinal polyposis (Turcot's syndrome): report of a case and critical analysis of the literature. We report a case of association of a brain tumor with multiple intestinal polyposis (Turcot's syndrome) and offer a critical analysis of the relevant literature with a view to revising the classification of the syndrome in relation to familial multiple polyposis and Gardner's syndrome. For this purpose, we considered only cases of intestinal polyposis associated with a primary neuroepithelial tumor (medulloblastoma, glioma, or glioblastoma) as originally described by Turcot. Differences emerged, depending on the central nervous system tumor type, which suggests that this neoplastic association may be classified as two distinct syndromes. ",1
"Early diastolic clicks after the Fontan procedure for double inlet left ventricle: anatomical and physiological correlates. M mode echocardiograms and simultaneous phonocardiograms were recorded in four patients with early diastolic clicks on auscultation. All had double inlet left ventricle and had undergone the Fontan procedure with closure of the right atrioventricular valve orifice by an artificial patch. The phonocardiogram confirmed a high frequency sound occurring 60-90 ms after aortic valve closure and coinciding with the time of maximal excursion of the atrioventricular valve patch towards the ventricular mass. One patient had coexisting congenital complete heart block. The M mode echocardiogram showed ""reversed"" motion of the patch towards the right atrium during atrial contraction. Doppler flow studies showed that coincident with this motion there was forward flow in the pulmonary artery with augmentation when atrial contraction coincided with ventricular systole. The early diastolic click in these patients was explained by abrupt cessation of the motion of the atrioventricular valve patch towards the ventricular mass in early diastole. In one patient atrial contraction led to a reversal of this motion and was associated with forward flow in the pulmonary artery. ",5
"Genetic mechanisms of tumor suppression by the human p53 gene. Mutations of the gene encoding p53, a 53-kilodalton cellular protein, are found frequently in human tumor cells, suggesting a crucial role for this gene in human oncogenesis. To model the stepwise mutation or loss of both p53 alleles during tumorigenesis, a human osteosarcoma cell line, Saos-2, was used that completely lacked endogenous p53. Single copies of exogenous p53 genes were then introduced by infecting cells with recombinant retroviruses containing either point-mutated or wild-type versions of the p53 cDNA sequence. Expression of wild-type p53 suppressed the neoplastic phenotype of Saos-2 cells, whereas expression of mutated p53 conferred a limited growth advantage to cells in the absence of wild-type p53. Wild-type p53 was phenotypically dominant to mutated p53 in a two-allele configuration. These results suggest that, as with the retinoblastoma gene, mutation of both alleles of the p53 gene is essential for its role in oncogenesis. ",1
"Quadricuspid aortic valve and aortic regurgitation diagnosed by Doppler echocardiography: report of two cases and review of the literature. Two cases of patients with quadricuspid aortic valve diagnosed by Doppler echocardiography are presented. Aortic regurgitation was detected by pulsed Doppler echocardiography in both patients. Because they were young patients, this aortic regurgitation indicated that aortic regurgitation is not necessarily a late-developing event, as has been thought previously. ",4
"Use of leukocyte-depleted platelet concentrates for the prevention of refractoriness and primary HLA alloimmunization: a prospective, randomized trial. Compared with conventional transfusion regimes a strong reduction in HLA alloimmunization and refractoriness to platelet transfusions is obtained when both red blood cell concentrates (RBCs) and platelet concentrates (PCs) are depleted of leukocytes by filtration. Because most of the leukocyte contamination is introduced by transfusion of RBCs, filtration of RBCs appears rational, but uncertainty exists regarding the degree of leukocyte-depletion of PCs needed for the prevention of HLA alloimmunization and refractoriness. We conducted a prospective trial and randomized patients with acute leukemia to receive leukocyte-depleted PCs prepared either by centrifugation (mean leukocyte count 35 x 10(6)/PC of 6 U) or by filtration (mean leukocyte count less than 5 x 10(6)/PC of 6 U). Both groups received RBCs that were filtered after prior removal of the buffy coat. Clinical refractoriness occurred in 46% (12 of 26) of the evaluable patients that were transfused with centrifuged PCs and only in 11% (3 of 27) in the filtered group (P less than .005). De novo anti-HLA antibodies were detected in 42% (11 of 26) patients in the centrifuged group and only in 7% (2 of 27) of the patients receiving filtered PCs (P less than .004). In 8 of 11 alloimmunized patients in the centrifuged group antibodies were detected in the first 4 weeks of transfusion therapy while none of the patients in the filtered group became immunized against HLA antigens during that period. We conclude that for the prevention of HLA alloimmunization and refractoriness to platelet transfusions from random donors, both RBCs and PCs have to be leukocyte-depleted by filtration. ",1
"The supraspinal anxiolytic effect of baclofen for spasticity reduction. Recent studies in the psychiatric literature indicate that baclofen has an anxiolytic action in certain psychopathologic conditions. Clinical observation has shown that manifestations of spasticity are increased in anxious individuals, implicating a supraspinal site of mediation for these responses. The purposes of this study were to determine if baclofen reduced anxiety in individuals with traumatic spinal cord lesions and whether that reduction was correlated with decreased spasticity from the baclofen. Five adult males with traumatic spinal cord injury were randomly assigned to the study protocol. A double-blind, repeated measures, multiple base-line, single-case research design was employed. The independent variable was dose of medication with the three levels being placebo, 40 mg/day of baclofen and 80 mg/day of baclofen, in four evenly divided doses. The dependent variable was the score obtained on the Beck Inventory-A anxiety scale (BIA). The subjects were administered the BIA twice per week for a nine-week period of time, during which they received the doses of medication as described. Quantitative measurements of spasticity were also taken at each session. Visual inspection analysis of the data showed that two subjects had no measurable anxiety of the BIA throughout the study. Three subjects had measurable anxiety on the BIA during the base-line/placebo phase. They showed a decreased level of their BIA scores with 40 mg/day of baclofen, and a further level reduction with 80 mg/day of baclofen. The reduction in BIA scores was statistically significant using the standard deviation band test in one of these subjects. These data indicate that BIA probably has an anxiolytic effect for individuals status post-traumatic spinal cord injury. ",3
"Early diagnosis and survival of ruptured abdominal aortic aneurysms. The hospital records of patients treated with ruptured abdominal aortic aneurysm in a recent 5-year period were reviewed to collect data on factors which may be associated with mortality. Overall mortality was 62%. Patients with intraperitoneal rupture had a higher mortality (97%) than patients with retroperitoneal rupture (25%). Patients at increased risk were older than 80 years, presented with syncope, experienced a short duration of symptoms prior to emergency department (ED) arrival, had initial systolic blood pressure less than 90 mm Hg, and/or initial hemoglobin level less than eight on arrival at the ED and delay in beginning surgery. Multivariate analysis demonstrated preoperative blood pressure, preoperative hemoglobin, presence of syncope, and the amount of blood transfused were largely reflections of the type of rupture and had only slight independent relationship to mortality. The authors concluded that treating emergency physicians and surgeons have little control over the most important risk factors for mortality after aneurysm rupture, but may improve the prognosis by expediting diagnosis in the ED and surgical therapy. ",3
"Recurrent transient ischemic attacks and stroke in association with an internal carotid artery web Fibromuscular dysplasia is a nonatherosclerotic vascular disease that most commonly affects cervical carotid arteries at the C1-C2 level when cephalic arteries are involved. Several histopathologic and angiographic subtypes of fibromuscular dysplasia exist; most have a benign natural history. We describe the third reported case of a pathologically proven, symptomatic proximal internal carotid artery web and suggest that patients with this lesion are at a higher risk for stroke. ",4
