text,label
"T cell receptor peptide therapy triggers autoregulation of experimental encephalomyelitis. Encephalitogenic T cells specific for myelin basic protein share common V beta 8 peptide sequences in their T cell receptor (TCR) that can induce autoregulatory T cells and antibodies that prevent clinical signs of experimental autoimmune encephalomyelitis (EAE). It is not known, however, if TCR peptides can treat established disease. To test its therapeutic value, TCR-V beta 8-39-59 peptide was injected into rats with clinical signs of EAE. This treatment reduced disease severity and speeded recovery, apparently by boosting anti-V beta 8 T cells and antibodies raised naturally in response to encephalitogenic V beta 8+ T cells. These results demonstrate that synthetic TCR peptides can be used therapeutically, and implicate the TCR-V beta 8-39-59 sequence as a natural idiotope involved in EAE recovery. Similarly, human TCR peptides may be effective in enhancing natural regulation of autoreactive T cells that share common V genes. ",3
"Small bowel obstruction associated with a leiomyomatous uterus. A case report and review of the literature. A 38-year-old woman developed small bowel obstruction shortly after a cholecystectomy because of a massively enlarged leiomyomatous uterus. Small bowel obstruction is a relatively rare complication from fibroid tumors and results from entrapment of the bowel between serosal pedunculated fibroids (as in this patient), adhesions to infarcted leiomyomas, or from compression of the small bowel by the large mass. Large uterine leiomyomas clearly must be considered in the etiology of intestinal obstruction. ",2
"The Van Nes tibial rotationplasty. A functionally viable reconstructive procedure in children who have a tumor of the distal end of the femur. Twelve patients who had a malignant tumor of the distal end of the femur were treated with a Van Nes tibial rotationplasty. The survival rates were comparable with those for above-the-knee amputees and patients who had an endoprosthetic replacement. The results of functional testing showed that these patients performed as well as those who had endoprosthetic replacement and better than those who had above-the-knee amputation. Rotationplasty is therefore a favorable alternative to amputation or endoprosthetic replacement, either as a primary or as a salvage procedure. ",1
"The association of elevated plasma homocyst(e)ine with progression of symptomatic peripheral arterial disease. Plasma homocyst(e)ine (the sum of free and bound homocysteine, homocystine, and the mixed disulfide homocysteine-cysteine, expressed as homocysteine) levels were determined by high performance liquid chromatography in 214 patients with symptomatic (claudication, rest pain, gangrene, amputation) lower extremity arterial occlusive disease and/or symptomatic (stroke, cerebral transient ischemic attacks) cerebral vascular disease and in 103 control persons. Mean plasma homocyst(e)ine was significantly higher in patients than in controls (14.37 +/- 6.89 nmol/ml vs 10.10 +/- 2.16, p less than 0.05). Thirty-nine percent of patients (83 of 214) had plasma homocyst(e)ine values greater than control mean + 2 standard deviations. Plasma homocyst(e)ine values were contrasted to age, male sex, diabetes, hypertension, smoking, renal failure, and plasma cholesterol. No difference was found in the incidence and/or level of any of these risk factors when patients with normal plasma homocyst(e)ine were compared to those with elevated plasma homocyst(e)ine, both by univariate and multivariate analysis. Patients with elevated plasma homocyst(e)ine were more likely to demonstrate clinical progression of lower extremity disease and of coronary artery disease, but not of cerebral vascular disease than were patients with normal plasma homocyst(e)ine, and the rate of progression was more rapid (p = 0.002). Progression of lower extremity disease as assessed in the vascular laboratory was also more common in patients with elevated plasma homocyst(e)ine (p = 0.01). We conclude that elevated plasma homocyst(e)ine is an independent risk factor for symptomatic lower extremity disease or cerebral vascular disease or both. Symptomatic patients with lower extremity disease and with elevated plasma homocyst(e)ine also appear to have more rapid progression of disease. ",5
"Nasal valve malfunction resulting from resection of cancer. Following cancer resection of the nasal unit, nasal valve malfunction is manifested by the symptoms of nasal stuffiness or difficulty getting air into the nostril. These symptoms occur in cases in which the resection is in the alar crease at the junction with the lateral sidewall of the nose. Wound scar contracture elevates the alar margin and causes the alar and lateral cartilages to move inward forming a visible and palpable shelf on the lateral wall of the nasal vestibule. This displacement of the alar and lateral cartilages and the rigid scar formed between these cartilages render the nasal valve immobile. Since it is easier to prevent nasal valve malfunction than to repair it later, wounds that bridge the alar crease or are located in either the alae or lateral sidewall and come within 1 mm of the alar crease with a total diameter of 1.0 cm should be repaired to prevent nasal valve malfunction. In the process of repairing deep defects, the overlapping region of the lateral crus of the alar cartilage and the lateral cartilage may be stabilized by a conchal cartilage graft. This cartilage graft may be used in combination with reconstruction of the nasal skin with a forehead flap and repair of the nasal lining. In the event that the nasal lining is intact, the cartilage graft may be used with a full-thickness skin graft. ",5
"Early gastric cancer. Twenty-eight-year experience. A retrospective study of early gastric cancer (60 patients) was performed to evaluate its diagnosis and treatment. Ninety-five per cent of patients presented with nonspecific gastrointestinal symptoms and 53.3% had been treated for presumed benign disease for up to 48 months before diagnosis. Fiberoptic endoscopy detected these lesions more accurately than radiologic examination. The disease-free 5-year survival rate after resection was 76.4%. Survival showed no significant correlation with sex, tumor site, macroscopic appearance, extent of gastric resection, or histopathologic type. Tumors larger than 1.5 cm in diameter, invasion of submucosa, or lymph node metastasis resulted in significantly lower survival rates. Three of eight patients with nodal metastasis survived 5 or more years, including one who had second-echelon deposits. A high index of suspicion may permit more frequent detection. Extended lymphadenectomy (R2) is recommended to achieve the highest possible cure rate. ",1
"Glomerular IgA deposits in patients with celiac disease. Glomerular immunopathology was studied in 25 patients with newly diagnosed celiac disease. None had clinical signs of renal disease. Glomeruli were obtained by fine-needle aspiration biopsy. The specimens were processed and studied by indirect immunofluorescence for immunoglobulins and complement. Mesangial IgA was found in 8 of the patients. It occurred occasionally together with slight IgG or IgM, but C3 was not seen in these patients. IgA-class circulating immune complexes (CIC), antireticulin antibodies (ARA), antigliadin antibodies (AGA), and rheumatoid factor (RF) occurred significantly more often in the patients with mesangial IgA than in the 17 patients having no mesangial IgA. The patients with mesangial IgA also had significantly higher mean levels of serum IgA, IgA-ARA and IgA-AGA than those without. The results suggest that glomerular mesangial deposits of IgA occur frequently in untreated celiac disease and that they are in some way associated with circulating IgA-class antibodies and immune complexes. In this situation IgA seems to be deposited without being able to induce clinically overt glomerulonephritis, a circumstance that may be related to the lack of complement in the deposits. ",2
"Treatment of angiomas with sclerosing injection of hydroxypolyethoxydodecan. The authors discuss the indications for hydroxypolyethoxydodecan in the sclerosing treatment of angiomas, with particular reference to cavernous, venous, and evolutive angiomas (ie, immature angiomas that fail to involute by eight to ten months). Moreover, the sclerosing agent may be employed, in connection with embolization and subsequent surgery, in arteriovenous angiomas with a relevant cutaneous-subcutaneous development. The authors have successfully used the ""interstitial"" sclerosing technique, according to Andrews' method. This technique involves interstitial injections to obtain the sclerosis of the thin threads of fibrous tissue stroma between the blood vessels. The sclerosing therapy may cause the complete regression of ""low flow"" angiomas or, at least, a partial reduction that simplifies the ensuing surgical excision. In the case of partial regression of the angioma obtained with the sclerosing therapy, the surgery of the remaining angioma causes a lesser degree of bleeding (especially in areas that do not particularly lend themselves to surgical exploration, ie, the oral cavity); an increased reliability in the radicality of the intervention (due also to the reduced size of the lesion); and better results from an aesthetic-functional point of view. ",1
"Avoiding interpretive pitfalls when assessing arrhythmia suppression after myocardial infarction: insights from the long-term observations of the placebo-treated patients in the Cardiac Arrhythmia Pilot Study (CAPS) The Cardiac Arrhythmia Pilot Study (CAPS) was a 1 year trial that analyzed the safety and effectiveness of arrhythmia suppression in 502 patients surviving acute myocardial infarction who had greater than or equal to 10 ventricular premature depolarizations/h or greater than or equal to 5 runs of ventricular tachycardia on a Holter recording obtained 6 to 60 days after the acute infarction. Because 100 of these patients received placebo in a double-blind fashion for 1 year, a comprehensive objective analysis was performed of spontaneous arrhythmia changes based on real data rather than statistical estimates. In the CAPS placebo group, 19% developed some serious clinical event in 1 year (death, heart failure, proarrhythmia) that could likely be attributable to antiarrhythmic drug toxicity. A significant reduction in the frequency of ventricular premature depolarizations (p = 0.004) occurred in the first few weeks of ""therapy"" with a further significant (p less than 0.04) decrease between 3 to 12 months. After initiation of placebo antiarrhythmic therapy, 27% had ""apparent ventricular premature depolarization suppression"" (greater than or equal to 70% reduction) after one Holter recording evaluation and nearly half (48%) after six Holter recordings to assess suppression were performed. ",4
"Recent advance in treatment of Stanford type A aortic dissection. During the period between November 1986 and November 1988, 13 consecutive patients with Stanford type A aortic dissection (8 acute and 5 chronic) were treated as follows: (1) urgent operation for cases with pericardial tamponade or severe heart failure, (2) initial medical treatment followed by elective operation for acute but stable cases or chronic cases, and (3) routine use of open distal anastomosis or selective cerebral perfusion. One patient died during medical treatment: 5 patients were operated on emergently. The remaining 2 acute and 5 chronic cases were operated on electively. There were no operative deaths, neurological disturbances, or late deaths. It is suggested that acute dissection of the ascending aorta requires immediate surgical intervention, especially when the entry is in the ascending aorta. On the other hand, it is also suggested that one could avoid emergency operations in selected cases with retrograde extension of the aortic dissection. ",4
"Multiple intracranial mucoceles associated with phaeohyphomycosis of the paranasal sinuses. The purpose of this article is to alert clinicians to a new pathogenic fungus of the paranasal sinuses called Exserohilum rostratum. Exserohilum species are one of the etiologic agents of phaeohyphomycosis, a constellation of entities caused by dematiaceous fungi. This class of fungal sinus infection has emerged only in the past decade; it occurs primarily in immunocompetent individuals and produces a tenacious, progressive pansinusitis. To our knowledge, this study describes the first case of multiple intracranial mucoceles secondary to E rostratum. The diagnostic workup includes computed tomography and magnetic resonance imaging followed by direct microscopic examination of tissue biopsy specimens. A craniotomy followed by a bilateral external ethmoidectomy was necessary for complete extirpation of the infected mucoceles. Aggressive surgical management of this mycotic infection is described. ",3
"Clinoidal meningiomas. Anterior clinoidal meningiomas are frequently grouped with suprasellar or sphenoid ridge meningiomas, masking their notorious association with a high mortality and morbidity rate, failure of total removal, and recurrence. To avoid injury to encased cerebral vessels, most surgeons are content with subtotal removal. Without total removal, however, recurrence is expected. Recent advances in cranial-base exposure and cavernous sinus surgery have facilitated radical total removal. The author reports 24 cases operated on with vigorous attempts at total removal of the tumor with involved dura and bone. This experience has distinguished three groups (I, II, and III) which influence surgical difficulties, the success of total removal, and outcome. These subgroups relate to the presence of interfacing arachnoid membranes between the tumor and cerebral vessels. The presence or absence of arachnoid membranes depends on the origin of the tumor and its relation to the naked segment of carotid artery lying outside the carotid cistern. Total removal was impossible in the three patients in Group I, with postoperative death occurring in one patient and hemiplegia in another. Total removal was achieved in 18 of the 19 patients in Group II, with one death from pulmonary embolism. In the two patients in Group III, total removal without complications was easily achieved. ",3
Parotid gland plasmacytoma with crystalline deposits. A case of primary extramedullary plasmacytoma of the parotid gland with a marked deposition of intracytoplasmic crystals is presented. The immunohistochemical and ultrastructural characteristics of the crystals suggest formation from monoclonal immunoglobulin. ,1
"Cross-linked hemoglobin solution as a resuscitative fluid after hemorrhage in the rat. Intramolecularly (alpha-alpha) cross-linked hemoglobin has been reported to have oxygen transport properties similar to those of whole blood. The present study evaluated the efficacy of diaspirin alpha-alpha cross-linked hemoglobin solution as a resuscitation fluid, with heart rate, mean arterial pressure, and transcutaneous oxygen tension as the study parameters. Rats were bled and approximately one third of their total blood volume (20 ml/kg) was removed while they were anesthetized; they were then resuscitated with 14% hemoglobin solution. Animals that received either 10 mg/kg (n = 10) or 20 mg/kg (n = 10) of hemoglobin solution responded quickly and positively to the infusions: mean arterial pressure (which had dropped to less than 40% of prehemorrhage levels) returned to baseline within 2 minutes of initiating infusion; by 4 minutes, the mean arterial pressures of the hemoglobin-infused groups were significantly higher (p less than or equal to 0.05) than those in both the autologous shed blood (n = 8) and lactated Ringer's (n = 10) groups. The heart rate and transcutaneous oxygen tension responses in both the half-volume and full-volume replacement hemoglobin groups matched the response to autologous shed blood throughout the hour of observation. The favorable hemodynamic response to infusion of cross-linked hemoglobin solution after hemorrhage suggests that this material is comparable to autologous shed blood and superior to lactated Ringer's solution as a resuscitative fluid as assessed in this model. ",5
Oral squamous cell carcinoma arising in a patient with long-standing lichen planus. A case report. The risk of malignant transformation of oral lichen planus remains a controversial point. Many previous reports have been discounted on the basis of inadequate information or lack of histologic confirmation of lichen planus. We report a well-documented case of long-standing cutaneous and oral lichen planus in which squamous cell carcinoma of the dorsal portion of the tongue occurred. There is an apparent difference in the sites of oral carcinomas in patients with lichen planus compared with the general population. This suggests that lichen planus increases the risk of oral cancer in affected sites. ,5
"Sixty consecutive breast reconstructions with the inflatable expander: a critical appraisal. Breast reconstruction using inflatable expanders has become an established and preferred technique. Although our knowledge of the biomechanical changes occurring in expanded skin has increased greatly, little information is available regarding average aesthetic results achieved with this technique. In order to eliminate the bias of best case selection reports, this study of 60 consecutive patients undergoing skin-expansion breast reconstruction was undertaken. Results of the study demonstrated a significant frequency and diversity of complications. In particular, immediate breast reconstruction with skin expanders was identified as a high-risk procedure because of its association with skin necrosis and delayed wound healing. Although two procedures--insertion and replacement--had been anticipated, patients from both the Boston and New York groups required approximately three operations to complete the expansion process. Average aesthetic results, often characterized by problems of symmetry, ptosis, and contour, need to be recognized and improved. ",5
Solitary dorsal intramedullary schwannoma. Case report. A case of solitary dorsal intramedullary schwannoma diagnosed by magnetic resonance imaging and treated surgically is reported. The authors review the previously published cases. The possible etiology of the tumor as well as some difficulties encountered in the diagnostic procedure and treatment are discussed. ,3
"Treatment of recurrent ischemia after thrombolysis and successful reperfusion for acute myocardial infarction: effect on in-hospital mortality and left ventricular function. To determine the effect of treatment of recurrent ischemia after reperfusion for acute myocardial infarction on in-hospital mortality and left ventricular function recovery and to identify patients at highest risk of serious consequences in the event of recurrent ischemia in this setting, 405 consecutively treated patients were studied retrospectively. All patients received intravenous thrombolytic therapy within 6 h of ST segment elevation-documented infarction and had angiographic confirmation of their reperfusion status performed within 120 min of treatment. Three hundred three patients had successful reperfusion with or without rescue angioplasty and had no recurrent ischemia (group 1), 74 patients had initially successful reperfusion but subsequent recurrent ischemia (group 2) and 28 patients had failed reperfusion (group 3). The in-hospital mortality in groups 1 to 3 was 2.0%, 14.9% and 32.1%, respectively (p less than 0.001) and the change from baseline to prehospital discharge left ventricular ejection fraction was 1.2 +/- 9.3%, -0.8 +/- 8.7% and -4.3 +/- 5.3%, respectively (p = NS). Within the recurrent ischemia group (group 2), multiple regression analysis found absence of cardiogenic shock at presentation (p = 0.002) and successful treatment initiated within 90 min of recurrent ischemia (p = 0.045) to be the only variables independently correlated with in-hospital survival. Later successful reperfusion was not associated with improved hospital survival. The timing and success of treatment did not affect recovery of global or regional left ventricular function in the patients with paired angiographic studies. ",5
"Treatment of chronic tinea pedis (athlete's foot type) with topical terbinafine. Twenty-seven patients with chronic tinea pedis, athlete's foot type, were enrolled in a randomized, double-blind trial of topical treatment with terbinafine 1% cream versus its vehicle (placebo). Patients were examined weekly during 4 weeks of twice-daily treatment and at follow-up 2 weeks after the conclusion of therapy. No adverse events were reported in either treatment group. Drug efficacy was evaluated in 22 patients, of whom nine (41%) were treated with terbinafine and 13 (59%) with placebo. Analysis of combined mycologic and clinical results showed that terbinafine was significantly more effective than placebo at the end of therapy (78% vs zero) and at the 2-week follow-up (89% vs zero) (p less than or equal to 0.001 at both intervals. ",5
"Topical calcipotriol treatment in advanced breast cancer [published erratum appears in Lancet 1991 Jun 29;337(8757):1618] 19 patients with locally advanced or cutaneous metastatic breast cancer were treated with the topical vitamin D analogue calcipotriol 100 micrograms daily. 14 patients completed 6 weeks' treatment; 3 showed a 50% reduction in the bidimensional diameter of treated lesions and 1 other patient showed a minimal response. 2 patients became hypercalcaemic during treatment. In all patients who responded the tumours contained receptors for 1,25-dihydroxyvitamin D3, shown by immunocytochemistry. ",1
"Clinical implications of screening for cervical cancer under Medicare. The natural history of cervical cancer in the elderly: what do we know? What do we need to know? Despite the recent passage of coverage for Papanicolaou test screening under Medicare, several aspects of the natural history of cervical cancer in the elderly remain uncertain. This article reviews what we know about cervical cancer in elderly women to provide clinicians with the background necessary for assessments of screening recommendations, integration of new data into practice, and development of consensus approaches to screening in the elderly. Two central questions that affect a screening program for the elderly are how long the neoplastic process takes from preinvasive disease to the development of invasive cancer, and how likely is it that a given neoplastic state observed in an elderly woman will, in fact, progress to a more severe state. The ultimate success of the new Medicare benefit will also be affected by the use of Papanicolaou testing, the technique of obtaining the smear, and the adequacy of reporting and follow-up. The expansion of Medicare benefits to include early cervical cancer detection has the potential to improve the quality and the duration of older women's lives. ",1
"Mild hypothermic cardiopulmonary resuscitation improves outcome after prolonged cardiac arrest in dogs BACKGROUND AND METHODS: This study was designed to explore the effect of mild cerebral and systemic hypothermia (34 degrees C) on outcome after prolonged cardiac arrest in dogs. After ventricular fibrillation with no flow of 10 min, and standard external CPR with epinephrine (low flow) from ventricular fibrillation time of 10 to 15 min, defibrillation and restoration of spontaneous normotension were between ventricular fibrillation time of 16 and 20 min. This procedure was followed by controlled ventilation to 20 hr postarrest and intensive care to 72 hr postarrest. In control group 1 (n = 10), core temperature was 37.5 degrees C; in control group 2 (n = 10), cooling was started immediately after restoration of spontaneous normotension; and in group 3 (n = 10), cooling was initiated with start of CPR. Cooling was by clinically feasible methods. RESULTS: Best overall performance categories achieved (1 = normal; 5 = brain death) were better in group 2 (p = .012) and group 3 (p = .005) than in group 1. Best neurologic deficit scores were 36 +/- 14% in group 1, 22 +/- 15% in group 2 (p = .02), and 19 +/- 18% in group 3 (p = .01). Brain histopathologic damage scores were also lower (better) in groups 2 (p = .05) and 3 (p = .03). Myocardial damage was the same in all three groups. CONCLUSION: Mild cerebral hypothermia started during or immediately after external CPR improves neurologic recovery. ",4
"Lack of change in neurochemical markers during the postepileptic phase of intrahippocampal tetanus toxin syndrome in rats. The chronic epileptic syndrome induced by injecting tetanus toxin into rat hippocampus causes functional changes that essentially are permanent, outlasting the period of active seizures by at least 1 year. These long-term changes have been characterized by an impaired performance on a range of behavioral tasks, which in turn have been associated with a physiologic depression of hippocampal evoked responses but not with any discernible histopathology. In the present study, we examined the hippocampi of rats in the postseizure phase of the tetanus toxin model and observed no significant changes in the concentration of neurochemical markers for six neurotransmitters. Therefore, the long-term reduction in hippocampal excitability cannot be attributed to any major loss of afferents or hippocampal neurons using aspartate, acetylcholine, gamma-aminobutyric acid (GABA), glutamate, norepinephrine (NE), or serotonin as their transmitters. ",3
