text,label
"Human T-cell leukemia virus type I infection as an oncogenic and prognostic risk factor in cervical and vaginal carcinoma. The seroprevalence of human T-cell leukemia virus type I (HTLV-I) antibody in 6701 healthy females and 226 women with gynecologic malignancies, all living in an adult T-cell leukemia-endemic area in southwestern Japan, was investigated to determine whether HTLV-I infection was a risk factor influencing oncogenesis and prognosis. The seroprevalences in cervical carcinoma patients younger than 59 years and in vaginal carcinoma patients of all ages were significantly higher than in age-matched healthy controls. The ratios of observed to expected HTLV-I seroprevalence in patients younger than 59 with cervical carcinoma and in vaginal carcinoma patients were 2.92 and 7.36, respectively. Among the patients with cervical carcinoma or vaginal carcinoma, the tumor recurrence rate in HTLV-I carriers was significantly higher than that in HTLV-I seronegative patients. Our results suggest that HTLV-I infection may be oncogenic and may affect the prognosis in some patients with cervical or vaginal carcinoma. ",1
"Selection of patients with stage B prostate cancer for radical prostatectomy. There are several areas of concern in dealing with clinical stage B disease. First, understaging is common. Second, recognition of extension into the seminal vesicles is important. Third, the patient's predicted life expectancy must be taken into account. Moreover, even clinically localized prostate cancer may have metastasized, and the need for surgical staging by lymph node dissection has been a significant factor in the authors' preference for radical retropubic rather than radical perineal prostatectomy. Neither of the two serum markers in clinical use is an absolute predictor of stage. Analysis of tumor ploidy may prove useful, and transrectal ultrasound warrants further study. In the elderly patient, the urologist certainly may elect to monitor the tumor without definitely deciding on operative versus conservative treatment. ",1
"The role of gastric resection in the management of multicentric argyrophil gastric carcinoids. A patient with pernicious anemia, atrophic non-antral gastritis, hypergastrinemia, and widespread hyperplasia of enterochromaffin-like cells and manifest enterochromaffin-like cell carcinoma was followed up during 39 months, including 15 months after gastric resection. In this case normalization of gastrin levels did not prevent the development of multiple gastric carcinoids in the fundic mucosa, suggesting that factors other than gastrin are of importance in the pathogenesis. ",2
"The Van Nes tibial rotationplasty. A functionally viable reconstructive procedure in children who have a tumor of the distal end of the femur. Twelve patients who had a malignant tumor of the distal end of the femur were treated with a Van Nes tibial rotationplasty. The survival rates were comparable with those for above-the-knee amputees and patients who had an endoprosthetic replacement. The results of functional testing showed that these patients performed as well as those who had endoprosthetic replacement and better than those who had above-the-knee amputation. Rotationplasty is therefore a favorable alternative to amputation or endoprosthetic replacement, either as a primary or as a salvage procedure. ",1
"Initial therapy of patients with Wilson's disease with tetrathiomolybdate. Patients with Wilson's disease who present with acute neurological symptoms often become clinically worse when initially treated with penicillamine. Other available anticopper drug therapies do not appear to offer a solution to this treatment problem. We are developing and evaluating a new drug, ammonium tetrathiomolybdate for this purpose. Theoretically, tetrathiomolybdate has optimal properties, including an immediate blockade of copper absorption and the property of forming complexes with copper in the blood, rendering the copper nontoxic. In this article, we present results from six patients treated with tetrathiomolybdate for up to 8 weeks as initial therapy. None of the five patients who had presented with acute neurological symptoms worsened. Also presented are methods of assay, preliminary stability studies, and methods of evaluating therapeutic end points with respect to copper metabolism. ",3
"Pyloric deformation from peptic disease. Radiographic evidence for incompetence rather than obstruction. We have used double-contrast radiographic techniques to clarify what changes in the configuration and movements of the gastroduodenal junction result when peptic lesions involve the distal gastric segment between the proximal (PPL) and the distal pyloric muscle loop (DPL). Among 50 cases of pyloric ulceration diagnosed during a four-year study period, 18 cases fulfilled all study criteria. Ulcers maintained a consistent location with regard to the muscular structures of the pylorus, and by affecting these structures, led to many strange deformations of the gastric outlet including permanent pseudodiverticula and reversal of pyloric angulation. The most common site for peptic lesions in the pyloric segment was the protuberance of the lesser curvature called the pyloric torus; many torus lesions extended into and destroyed the DPL. This led to widening of the gastric outlet and radiographic evidence of increased duodenogastric reflux. Pyloric closure was further impaired in this setting because the mucosa no longer prolapsed into the gastric outlet and did not occlude the pyloric lumen as it normally does. Less common lesions involved the greater curvature and the PPL. In one patient, scarring of the PPL led to an antral web and gastric hyperperistalsis. This was the only patient who required operation for chronic gastric outlet obstruction. One-third of the 18 patients had reflux esophagitis in addition to peptic pyloric disease. In most patients without additional ulcerogenic risk factors, treatment with antisecretory agents led to the healing of ulcer craters. We conclude that the morphologic and functional changes of the gastric outlet caused by peptic lesions depend, in part, on the effect the ulcer has on the underlying pyloric musculature. ",5
"Neuroexcitatory plasma amino acids are elevated in migraine. To investigate the role of glutamic (Glu) and aspartic acid (Asp) in migraine, we measured the plasma amino acids in migraine patients with and without aura, between and during attacks, and compared the profiles with the plasma amino acid profiles of tension headache patients and healthy controls. Between attacks, migraineurs (notably with aura) had substantially higher plasma Glu and Asp levels than did controls and tension headache patients. In addition, patients with migraine without aura showed low plasma histidine levels. During migraine attacks, Glu (and to a lesser extent Asp) levels were even further increased. The results suggest a defective cellular reuptake mechanism for Glu and Asp in migraineurs, and we hypothesize a similar defect at the neuronal/glial cell level, predisposing the brain of migraineurs to develop spreading depression. ",3
"The determinants and prognostic significance of serum uric acid in elderly patients of the European Working Party on High Blood Pressure in the Elderly trial. Determinants and risks associated with serum uric acid were investigated in 822 elderly hypertensive patients treated with hydrochlorothiazide and triamterene or placebo. Pretreatment serum uric acid levels were significantly higher in men than in women and had positive correlation with serum creatinine. After adjustment for serum creatinine, positive correlations of serum uric acid with body weight and fasting blood glucose in women and with serum cholesterol in men were significant. During follow-up, serum uric acid increased significantly in the treated patients, but remained unchanged in the placebo group. Total, cardiovascular, and noncardiovascular mortality were unrelated to initial serum uric acid levels. One placebo patient and seven treated patients developed gout. Of those seven, most were male patients and had significantly higher serum levels of uric acid and creatinine than the other patients. Gender and renal function were the major determinants of serum uric acid in elderly hypertensive patients. ",4
Cystic medionecrosis of the coronary arteries and fatal coronary vasospasm. The histopathological basis of coronary vasospasm is not well defined. We report a patient with directly observed coronary artery spasm in whom cystic medionecrosis of the coronary arteries and great vessels and myxomatous degeneration of the mitral valve were evident. We suggest that myxoid connective tissue lesions of the heart may be linked to coronary vasospasm. ,4
"Nasal valve malfunction resulting from resection of cancer. Following cancer resection of the nasal unit, nasal valve malfunction is manifested by the symptoms of nasal stuffiness or difficulty getting air into the nostril. These symptoms occur in cases in which the resection is in the alar crease at the junction with the lateral sidewall of the nose. Wound scar contracture elevates the alar margin and causes the alar and lateral cartilages to move inward forming a visible and palpable shelf on the lateral wall of the nasal vestibule. This displacement of the alar and lateral cartilages and the rigid scar formed between these cartilages render the nasal valve immobile. Since it is easier to prevent nasal valve malfunction than to repair it later, wounds that bridge the alar crease or are located in either the alae or lateral sidewall and come within 1 mm of the alar crease with a total diameter of 1.0 cm should be repaired to prevent nasal valve malfunction. In the process of repairing deep defects, the overlapping region of the lateral crus of the alar cartilage and the lateral cartilage may be stabilized by a conchal cartilage graft. This cartilage graft may be used in combination with reconstruction of the nasal skin with a forehead flap and repair of the nasal lining. In the event that the nasal lining is intact, the cartilage graft may be used with a full-thickness skin graft. ",5
"Surgical treatment of low rectovaginal fistulas. Forty women with low rectovaginal fistulas were operated upon over a 9-year period. The etiology of the fistula in the majority was obstetric. Nine women had prior attempts to repair the fistula. All 40 women were managed with endorectal advancement flap with the addition of sphincteroplasty or perineal body reconstruction in 15 patients and rectocele repair in six patients. Postoperative complications included urinary difficulties (two patients) and wound complications (three patients). There were two recurrences. All women treated with sphincteroplasty or perineal body reconstruction were continent. Seven women complained of varying degrees of incontinence postoperatively; none had undergone sphincter or perineal body reconstruction. Endorectal advancement flap is a safe and effective operation for women with rectovaginal fistulas. Concomitant sphincteroplasty or perineal body reconstruction should be performed in women with historical, physical, or manometric evidence of incontinence. ",2
"Embolization with particles in thoracic intramedullary arteriovenous malformations: long-term angiographic and clinical results. To evaluate the long-term results of endovascular treatment with particles in the management of thoracic intramedullary arteriovenous malformations (AVMs), the authors retrospectively reviewed the angiographic and clinical findings in 35 patients. Follow-up was 1-15 years (mean, 6 years) in 28 patients and 6-10 months (mean, 7 months) in seven. A total of 158 embolization procedures were performed in 35 patients. Revascularization occurred frequently, necessitating multiple endovascular sessions. Long-term clinical evaluation showed clinical improvement, compared with the initial status before treatment, in 63% of the patients. Clinical aggravation due to embolization was observed in seven patients (20%) after 12 of the 158 endovascular sessions (8%). These results are better than those reported after surgery and indicate that embolization with particles is an efficient and safe tool in the treatment of thoracic intramedullary AVMs. ",4
"Effects of nimodipine on infarct size and cerebral acidosis after middle cerebral artery occlusion in the rat. The objective of this study was to determine the effect of nimodipine on infarct development and local brain pH after middle cerebral artery occlusion in the rat. Female Fischer-344 rats were subjected to permanent occlusion of the left middle cerebral artery by electrocoagulation. After 6, 12, or 24 hours, brains were frozen, and infarct size, degree of edema formation, and local brain pH were quantified by standard histology or the umbelliferone technique, respectively. In control rats, cortical infarct size was increased from 29.5 microliters at 6 hours to 72.5 microliters at 24 hours after vessel occlusion. In striatum only, an insignificant increase from 15.2 to 24.7 microliters in infarct volume was observed during this period. Edema increased from 7% to 22% in cortical and from 4% to 39% in the striatal infarct areas during this time. Nimodipine (0.1 mg/kg s.c.), given 45 minutes before and again 8 and 16 hours after middle cerebral artery occlusion, did not alter infarct size at 6 hours but considerably improved outcome at later times. Edema formation was lower at 12 hours in the group treated with the calcium antagonist (p less than 0.05). By contrast, effects on local brain pH were seen as early as 6 hours after the vessel occlusion. Nimodipine greatly reduced the areas exhibiting the lowest pH values beyond pH 6.0 (p less than 0.05). Similar effects by nimodipine on brain pH were observed in the 12-hour series, whereas at 24 hours after middle cerebral artery occlusion, a shift to more alkalotic values was noted with no overt differences between control and drug-treated groups. ",3
"Fatal or severely disabling cerebral infarction during hospitalization for stroke or transient ischemic attack. Six (1%) of 578 patients admitted for cerebral infarction or transient ischemic attack (TIA) suffered a fatal or severely disabling in-hospital cerebral infarction following a period of stabilization or improvement lasting more than 1 day. These infarctions were characterized by the sudden onset of stupor or coma and subsequent development of transtentorial herniation due to carotid or middle cerebral artery territory infarction, or widespread brain-stem infarction due to basilar occlusion. Only one patient survived. Four patients had large-vessel disease documented by Doppler, angiography, or at autopsy. Each of these six infarcts occurred during the morning hours, 4-9 days after the initial event, 3-8 days after initiation of intravenous heparin, and within 4-8 h after intravenous heparin had been discontinued. No coagulation abnormalities were documented. We believe that these cases indicate that among patients admitted for cerebral infarction or TIA, fatal or severely disabling in-hospital cerebral infarction after a period of stabilization or improvement may occur in patients having an initially mild to moderate clinical deficit, that those suffering large artery disease may be at greater risk, and that there may be a relationship between heparin withdrawal and cerebral infarction in some patients. ",3
"The human immunodeficiency virus type 1 polyadenylylation signal: a 3' long terminal repeat element upstream of the AAUAAA necessary for efficient polyadenylylation. Several polyadenylylation (PA) signals containing elements upstream of the AAUAAA have recently been characterized. Similar to PA elements found downstream of the AAUAAA, the upstream elements function to increase efficiency of AAUAAA use as a signal for cleavage and PA. Using deletion and linker scanning mutations we show that the PA signal of human immunodeficiency virus type 1 contains upstream elements transcribed from the U3 region of the 3' long terminal repeat. The element that has the greatest effect on PA site use lies 77 to 94 nucleotides upstream of the AAUAAA, between the TATA element and the transcriptional initiation site. Mutations in the adjacent region, between 59 and 76 nucleotides upstream of the AAUAAA, have a smaller effect on PA efficiency. Mutations in a region further upstream, between 141 and 176 nucleotides upstream of the AAUAAA, also affected PA modestly. Functional similarity between upstream elements was indicated by the ability of the human immunodeficiency virus upstream region to replace the upstream region of the simian virus 40 late PA signal. The sequence of the major upstream element of human immunodeficiency virus is uracil-rich, analogous to many defined downstream PA elements. This fact may imply that upstream and downstream elements have similar mechanisms of action. ",5
"Primary de novo adenocarcinoma of the colon measuring 8 mm in diameter with lymph node metastases. Report of a case. Colonic adenocarcinomas measuring less than 10 mm are rare. Herein, we report a carcinoma measuring 8 mm in diameter associated with subserosal extension through a ""locus minoris resistentiae"" and metastases to lymph nodes, an association not previously reported. No residual adenomatous tissue was found, suggesting a de novo carcinoma. ",1
"Mammographic measurements before and after augmentation mammaplasty. Thirty-five augmented women underwent mammography using both the standard implant-compression technique and, when possible, the implant-displacement technique; all had preaugmentation film-screen mammography available for evaluation. The area of mammographically visualized breast tissue before and after augmentation mammaplasty was measured using a transparent grid. Patients with subglandular implants had a mean decrease of 49 percent of measurable tissue area with compression mammography and a 39 percent decrease with displacement mammography. Patients with submuscular implants had a 28 percent decrease in measurable tissue area with compression mammography and a 9 percent decrease with displacement mammography. Anterior breast tissue was seen better with displacement mammography; posterior breast tissue, with compression mammography. Most patients had some degree of parenchymal scarring and lower image quality after augmentation. State-of-the-art mammography was not possible in most patients augmented with silicone-gel-filled implants. ",1
"SPECT imaging of pediatric brain tumor with hexakis (methoxyisobutylisonitrile) technetium (I). Technetium-99m-Hexamibi [Hexakis (methoxyisobutylisonitrile) technetium (i)] was developed as a myocardial perfusion agent with biologic properties similar to those of thallium-201 (201TI). As 201TI has recently been observed to be of value for the diagnosis of brain tumors when used in conjunction with single-photon emission computed tomography (SPECT) imaging technology, the possibility that the biologic similarity of the two radiopharmaceuticals extended to their affinity for tumors was tested. A 5-yr-old female patient with a brain stem astrocytoma showed marked focal uptake of 99mTc-Hexamibi at the site of tumor recurrence as defined by biopsy and prior 201TI/SPECT study. Tumor-to-normal cortex radioactivity ratios for the 99mTc-Hexamibi/SPECT study were 132:1 and the spatial resolution of the 99mTc-Hexamibi images was high. This observation suggests that 99mTc-Hexamibi merits further study as a potential agent for SPECT imaging of human brain tumors. ",1
"Cross-linked hemoglobin solution as a resuscitative fluid after hemorrhage in the rat. Intramolecularly (alpha-alpha) cross-linked hemoglobin has been reported to have oxygen transport properties similar to those of whole blood. The present study evaluated the efficacy of diaspirin alpha-alpha cross-linked hemoglobin solution as a resuscitation fluid, with heart rate, mean arterial pressure, and transcutaneous oxygen tension as the study parameters. Rats were bled and approximately one third of their total blood volume (20 ml/kg) was removed while they were anesthetized; they were then resuscitated with 14% hemoglobin solution. Animals that received either 10 mg/kg (n = 10) or 20 mg/kg (n = 10) of hemoglobin solution responded quickly and positively to the infusions: mean arterial pressure (which had dropped to less than 40% of prehemorrhage levels) returned to baseline within 2 minutes of initiating infusion; by 4 minutes, the mean arterial pressures of the hemoglobin-infused groups were significantly higher (p less than or equal to 0.05) than those in both the autologous shed blood (n = 8) and lactated Ringer's (n = 10) groups. The heart rate and transcutaneous oxygen tension responses in both the half-volume and full-volume replacement hemoglobin groups matched the response to autologous shed blood throughout the hour of observation. The favorable hemodynamic response to infusion of cross-linked hemoglobin solution after hemorrhage suggests that this material is comparable to autologous shed blood and superior to lactated Ringer's solution as a resuscitative fluid as assessed in this model. ",5
"Amyloidosis of the small intestine: findings on double-contrast radiographs. The appearance of the small intestinal mucosa on double-contrast barium examinations was studied in 26 patients with proved intestinal amyloidosis. Findings included innumerable fine granular densities 1-3 mm in diameter (16 patients), multiple nodular densities 3-4 mm in diameter (four patients), multiple polypoid protrusions 4-10 mm in diameter (three patients), irregularities of Kerckring folds (12 patients), and multiple erosions (eight patients). The multiple nodular densities and erosions disappeared after the patients were treated with total parenteral nutrition. The other abnormalities remained unchanged on follow-up examinations. Our results indicate that double-contrast radiographic findings of the small intestine in patients with amyloidosis include mucosal abnormalities that vary according to the pathologic type of amyloid deposition. ",2
"IgA triggers tumor necrosis factor alpha secretion by monocytes: a study in normal subjects and patients with alcoholic cirrhosis. Under endotoxin-free conditions, peripheral blood mononuclear cells and purified monocytes isolated from healthy control subjects and patients with alcoholic cirrhosis disclose elevated tumor necrosis factor alpha messenger RNA level and produce tumor necrosis factor alpha in response to stimulation by either soluble polymeric IgA or monomeric IgA bound to the surface of culture dishes but not by soluble monomeric IgA. Polymeric IgA induces tumor necrosis factor alpha secretion in a dose-dependent fashion. These results suggest that cross-linking of Fc alpha receptors on human monocytes induces the messenger RNA accumulation and the secretion of the cytotoxic and immunoregulatory cytokine tumor necrosis factor alpha. Furthermore, it is shown that lipopolysaccharide-induced tumor necrosis factor alpha secretion by peripheral blood mononuclear cells is synergistically enhanced in the presence of solid phase monomeric IgA but not in the presence of either soluble monomeric or polymeric IgA. Although increased lipopolysaccharide-induced tumor necrosis factor alpha secretion is observed at baseline in alcoholic cirrhotic patients, this synergism is also expressed in this group of patients. These observations could be of pathophysiological relevance in alcoholic cirrhosis because monomeric IgA deposits along the liver sinusoids and increased serum levels of polymeric IgA are common even in the early stages of this disease. ",2
"Glomerular IgA deposits in patients with celiac disease. Glomerular immunopathology was studied in 25 patients with newly diagnosed celiac disease. None had clinical signs of renal disease. Glomeruli were obtained by fine-needle aspiration biopsy. The specimens were processed and studied by indirect immunofluorescence for immunoglobulins and complement. Mesangial IgA was found in 8 of the patients. It occurred occasionally together with slight IgG or IgM, but C3 was not seen in these patients. IgA-class circulating immune complexes (CIC), antireticulin antibodies (ARA), antigliadin antibodies (AGA), and rheumatoid factor (RF) occurred significantly more often in the patients with mesangial IgA than in the 17 patients having no mesangial IgA. The patients with mesangial IgA also had significantly higher mean levels of serum IgA, IgA-ARA and IgA-AGA than those without. The results suggest that glomerular mesangial deposits of IgA occur frequently in untreated celiac disease and that they are in some way associated with circulating IgA-class antibodies and immune complexes. In this situation IgA seems to be deposited without being able to induce clinically overt glomerulonephritis, a circumstance that may be related to the lack of complement in the deposits. ",2
