text,label
"Sly Stallone is hardly the finest actor in the world but compared to his brother, Frank...well, roll out those awards now! Mullet haired, muppet Frank seems to think that every part he plays, calls for him doing the role as an American/Italian Wise-guy refugee from the 'Godfather.' Please, somebody make him an acting offer 'he can refuse!' This film just stinks the place out, even by the terrible overacting in this, Frank still steals the acting dishonours. All the people compensate for their lack of talent by shouting their lines and throwing their arms about, gesticulating wildly in a style that went out of fashion back with silent films.The plot, what there, is, makes no sense as a meteor lands and turns all the women into sex-crazed nymphets but as this is 15 certificate film, that just means they strip to their underwear and make moaning sounds like dogs on heat. What happens in the end, I'm not quite sure as I was losing the will to live long before the film finished.Avoid this like the plague and watch 'Deep Impact' for a reasonable film about a meteor about to hit the earth.N.B. Point of order: when one of the female leads strips down to her underwear, she has her knickers/panties under her suspenders/garter belt, it's knickers over the suspenders to allow women to go to the toilet with less fuss. A trivial point, perhaps, but shows how dumb this film is when they can't even get this right!",neg
"This is one of the worse cases of film drivel I have seen in a long while. It is so awful, that I am not sure where to begin, or even if it is worth it. The plot is the real problem, and I feel sorry for 'Sly' as he puts in a decent performance for his part. But that plot ... Oh dear oh dear. I particularly love the way near the end he manages to pop from the foot of a mountain to the top, whilst the helicopter is on the way. A climb of a day or two takes him all of five minutes! I could go on: but it isn't worth it. Apart from the grim opening (which even a five year old would be able to predict the outcome of) the rest is drivel. Sorry folks, but this is about as bad as film making gets.",neg
"This is a splendidly done simplistic film that explores a theme, and gives each viewer something different that they take from it. The premise is simple: an unnamed celebrity actor (Morgan Freeman) decides to research for an upcoming role by visiting a store and watching people. He takes particular interest in the cashier at the ""10 Items or Less"" lane (Paz Vega), who he finds an amiable, strong, and curious presence.Both actors play off each other brilliantly and bring solid dimension to characters in what is a character study. Not a conventional character study; they each represent entire worlds. The cashier's life is mired in a harsh and frustrating ""real world,"" while the actor is so enmeshed in his fantasy existence that he can't do simple tasks like remember phone numbers. He readily admits he's putting on a face when he talks to people, and the whole point of researching real people shows he's not one of them.But not only is the actor inspired by real people for his work; we see the reverse process as well. Several characters recognize ""Him,"" and make reference to how he has inspired them with his movie roles.The cashier's favorite song ""Al Pasar la Barca,"" about how a girl refuses to hide behind beauty and prefers instead to pay (ie: do honest work) for boat passage, couldn't have been chosen better. It parallels with the Vega character, the only store employee with any brains or ambition, who is willing to work hard to succeed. (That's quite an aspiration, for somebody who looks like Paz Vega.) It's an odd little film, probably made on a shoestring. If you don't mind slow pacing and a ""talky"" approach, this film will entertain. The characters are perfectly contrasted, and the effective acting makes them endearing. A nice watch.",pos
"Ohhh the brutality, ohhhhh the dying breed, ohhhh the sense of loss, ohhhh the prejudice! Jeez, when are all you whiney revisionists going to stop analyzing Westerns for crying out loud? S**t happens. If it offends your socially engineered sensibilities then go back to the comfort of your Meryl Steep collection.Boring, tedious, and very tiresome waste of celluloid-particularly in light of Coburn/Hackman/Bergen's presence. Nothing interesting or intriguing here, unless you are obsessed with 19th century desert dentisty. May have been a little better without the constant diversion of the out-of-place mexican guy with the bad tooth. A monument to the stupid ultra-left creeping sensitivity of the 60/70's. Virtually impossible to sit through the entire film. I think I'd rather have my eyes stapled open for the entire Lucky Luke/Trinity series. 4 Horses/10-all deader'n hell.",neg
"Carl Panzram lived an amazing life and scribbled down his memoirs on scraps of paper for possibly the only person who ever did anything selfless for him. The book ""Panzram: A Journal of Murder"" by Thomas E. Gaddis and James O. Long, which came out the better part of a century after Panzram's death, gives the historical context to a first-generation American's account of running away from home to go west and be a cowboy, getting caught, thrown in the boy's home, getting away repeatedly and thrown into prison over and over all the time getting tortured and sodomized. As Panzram grew huge and strong, he sought to take revenge for the wrong done to him as he traveled to South America, Europe and Africa, and it didn't matter what people he raped, robbed, or murdered because we are all equally worthless.This film casts skinny James Woods as the rough neck, mean-ass, son of a bitch Carl Panzram who in the film is a ""drunk"", overly-dramatic and emotional, and who never mentions the joy of sodomizing men and boys. The film neither elaborates on anything else particularly of note about this world traveler and career prisoner (like robbing former President Taft or being released from the Oregon prison as long as he gave his word to return). In short, I don't think Carl would be too happy.",neg
"This quasi J-horror film followed a young woman as she returns to her childhood village on the island of Shikoku to sell the family house and meet up with old friends. She finds that one, the daughter of the village priestess, drowned several years earlier. She and Fumiko (another childhood friend) then learn that Sayori's mother is trying to bring her back to life with black magic. Already the bonds between the dead and living are getting weak and the friends and villagers are seeing ghosts. Nothing was exceptional or even very good about this movie. Unlike stellar J-horror films, the suspense doesn't really build, the result doesn't seem overly threatening and the ending borders on the absurd.This movie is like plain white rice cooked a little too long so that it is bordering on mushy. Sometimes you get this at poor Asian restaurants or cook your own white rice a little too long. You end up eating it, because you need it with the meal, because what is Chinese or Japanese food without rice, but it almost ruins the meal because of the gluey, gooey tastelessness of it all. 3/10 http://blog.myspace.com/locoformovies",neg
"Sorry, but I will spoil both the plot line and the ending for you in hopes of avoiding a holiday fiasco like the one that I now face. The father dies and the mother asks Santa in a letter to bring him back to the family for Christmas,...and Santa does. Dad is peachy, happy healthy and totally unaware of the fact that he had died. All ends syrupy sweet.But as a parent who recently watched my five year-old lose his best canine friend, it was a horror flick. Now my son is convinced that all he has to do to bring his buddy back is to ask Santa! Do not underestimate the willpower of a young heart- no amount of persuasion will convince him that it was only a movie and that his dog is NOT coming back for Christmas. It has been heart breaking to watch his joy only to know that Christmas Eve he will have to face his loss afresh.Shame on you on behalf of all the believers that have lost a loved one recently. It is hard enough to deal with the loss one time for a child, but there are some wishes that we shouldn't even portray as a possibility.",neg
Loved Joan. Great performance. What isn't she good in. I watched this film and then Jane Eyre right after... she just keeps getting better. My heart was racing. Great old movie drama. Just what i want from a classic movie. Facial expressions are worth the whole film. I'm glad i have it on video. Don't know what more you need in a film. Beautiful woman....wealth..... greed.....murder....detectives......a trial.....The costumes are very nice. Makes me wonder what the budget was for this movie? Wish they still made films like this. Whenever they try they just seem to make a cheesy movie. Films in black and white still hold a certain mystery.,pos
"I can't say much about this film. I think it speaks for itself (as do the current ratings on here). I rented this about two years ago and I totally regretted it. I even /tried/ to like it by watching it twice, but I just couldn't. I can safely say that I have absolutely no desire to see this waste of time ever, ever again. And I'm not one to trash a movie, but I truly believe this was awful. It wasn't even funny in the slightest. The only bits I enjoyed were the few scenes with Christopher Walken in them. I think this film ruined both Jack Black and Ben Stiller for me. All I can think of when I see one of their films now-a-days is this terrible movie, and it reminds me not to waste my money. Amy Poehler is so very annoying, too.Overall, well, I think you get my point. The stars are for Walken, by the way.",neg
"Very much a film from the times -- extremely long sequences with no dialogue, bad flashbacks, and an almost entirely male cast. The two women who appear have a total of under 10 lines and exist only as romantic interests for men.O'Toole is riveting whenever he speaks; unfortunately, he spends much of his time peering through shrubbery. Alastair Sims is always a joy to see but he, too, is terribly underused.The film has one additional positive aspect, in that it depicts many aspects of British fascism and fascist sympathies (such as the casual appearance of the Mosley graffiti) that many people today are unaware of. Too many of today's films about WWII paint the Allies as all-good and the Axis as all-evil, when history tells us people are far more complicated than that!This would be a good movie for when you're recovering from the flu and are bundled on the couch and not able to absorb anything too complex. If you just need something to pass the time while your electrolytes stabilize, this is the movie for you.",neg
"This movie was horrible. I watched it three times, and not even the whole thing. It's just impossible to watch, the story line sucks, it's depressing, and utterly disgusting. I don't write spoilers for anything, so if you want to know why it's so disgusting, see it for yourself. The only good thing about this movie was John Savage, his dialogue at the beginning, and some funny parts in the movie. The little kid in this movie is annoying, and the whole situation is bullshit. I saw this movie at movie stores around America, so I assumed it would be a good movie. Jesus Christ, was I wrong!!!! The acting is all horrible, and the nudity itself is lame and nasty. Another thing is, Starr Andreef, the other main character, hasn't been in such bad movies in the past, in fact, she was in some pretty good ones. Same with John Savage. This movie SUCKS!",neg
"This film reminds me a lot of the anti-drug films of the 50's and 60's due to the fact that it was made by people that have obviously never experienced the social evil that they are warning us about. Tom Hanks and his buddies are ""role playing"", but there are no dice, lots of candles, and then you are just swept away in a bad montage showing Hanks falling for the lady in the group. quite funny but misguided. I wonder how many poor kids had their D&D stuff destroyed, and were told that the use of their imagination was the road to destruction. As a film it's basically an after school special, bad acting (although Hanks does show some of his talent) and relationship talks, and no one seems to be having any fun. It seems these films have a psychological focus on adolescents starting on the road to adultism, which is more serious, apparently, and requires you to buckle down and do the things everyone else does. Despite my vote of 2, this is worth watching due to its unique genre, scare films, which I personally find quite funny.",neg
"Steven Seagal....how could you be a part of such an awful film? I rented this movie because your movies usually have been pretty clean. I have lost a lot of respect for you being in an awful movie such as this one. Very, very poor taste! I am embarrassed that I even rented this movie. Steven, if you keep acting in movies like this one, I believe that your career is over. My husband and I have enjoyed watching many of your movies because you always can ""get the bad guy"" with a few hand maneuvers and make it clean...and also the language is pretty clean in your movies...but this one is something else. I will think twice before I rent another movie of yours.",neg
"This is about a mad scientist who creates a half shark - half man type critter on an uncharted island, then calls up all his old business and academic buddies to come and see his creation (evil laugh) but actually he wants his sharkman to kill them! Lots of bad GCI, goofy plot elements, and babes sweating in tight T-shirts follow.These monster movies all follow a similar formula, but this one spices things up with a bit of humor (I guarantee the folks who made this had tongues firmly planted in cheek), not to mention the sexy babes. But let's mention those sexy babes - several hot babes, in tight T-shirts, sweating profusely. One's in her undies at the beginning, another at the end. Thank you, thank you, makers of bad movies! The plot is full of goofy stuff, a guy drives up in a jeep, slams it right into a tree, then offers to fly everyone off the island in a helicopter. Yeah, um, well, how 'bout we think about that for a while; we'll get back to you. The sharkman is hilarious - either awful CGI or an equally comedic guy in a rubber suit. The mad scientist gives a pretty good performance; he's evil, that's his motivation, he makes no apologies.Overall, if you want a stupid, FUN B-movie, this one should do the job.",pos
"I wouldn't call it awful, but nothing at all shines in this movie, and it is encumbered with some seriously unbelievable basic plot development. It starts out well, but once the main hit is done, it devolves into a long subplot around a young girl which is not compelling, and some action scenes which are theatre of the absurd unrealistic. For example there is a prolonged shootout at the airport in which the lighting is all stroboscopic. No explanation for that. How credible is it that a airport storage area is going to have lights that flash on and off confusingly, and just enough to let Snipes do his incredible escape schtick? This is one of far too few action scenes punctuated by pointlessly drawn out set ups that just fails to draw one into suspending belief.In addition, the whole premise seems to be that the United States CIA team can shoot the place up but get away with it by saying ""national security"" to the Brits. This gimmick relies on a stereotype that is to far afield from reality to be satisfying.There are a lot better action movies out there. Better formulated, better executed. This one is entertaining at times but there is just not enough meat on the bone and after a while it becomes downright boring -- something that should never happen in a good action movie.",neg
"No one would argue that this 1945 war film was a masterpiece. (How could any 1945 war film be a masterpiece?) And yet this is an extremely effective telling of a true story, that of Al Schmidt, blinded on Guadalcanal, as played by John Garfield, who spent days wearing a blindfold to capture the nuances of a blind person's actions. Robert Leckie, in ""Helmet for My Pillow"",denigrates Schmidt's popularity in favor of his foxhole mate, who was killed, writing that ""the country must have needed live heroes."" Well, I suppose the country did. And they had one here. There is a single combat scene in the movie, bound to the studio lot, lasting only ten minutes or so, and occurring less than halfway through the film instead of being saved for the climax, but it is the scariest and most realistic depiction of men under fire that I can remember having seen on screen, including those in ""Saving Private Ryan"". Men yell with fear, scream at each other and at the enemy, and bleed and die, without the aid of color, stereophonic sound, squibs, or gore.Simply from a technological point of view, the film is outstanding. It isn't just that we learn how complicated a mechanism a .30 caliber, water-cooled Browning machine gun is, or that it must be fired in bursts of only a few rounds, or that it isn't waved around like a fire hose, as in so many other war movies. The technical precision adds to the scene's riveting quality. The need to stick to short bursts is horrifying when dozens of shrieking enemies are pouring across a creek fifty feet away with the sole aim of exterminating you and your two isolated comrades confined to a small gun emplacement. The performances are solid, if not bravura, including those of the ubiquitous 1940s support, John Ridgeley, and a radiant, youthful Eleanor Parker. The framing love story is spare, but it works, and ultimately is quite moving. A striking dream sequence is included. It's not Bunuel, but for a routine 1945 film, it stands out as original and effective. Albert Maltz may have overwritten the script, or it may have been altered by someone else. It could have used the kind of pruning that might have introduced some much needed ambiguity. Still, there are odd verbal punctuations that have a surprising impact on the viewer -- ""Why don't God strike me dead?"" And, ""In the eyes, Lee. Get 'em in the eyes!"" Depths of anguish in a few corny words. And a surprising amount of bitterness expressed by wounded veterans in a 1945 war film. Notes that might seem false to a contemporary viewer but perhaps shouldn't: the dated vernacular which it's difficult to believe many of today's kids could think was actually ever spoken -- ""private gab,"" ""dope"", ""drip,"" ""Gee,"" ""you dumb coot,"" ""dame,"" ""a swell guy,"" and ""feeling sorry for yourself."" Let us consider the historical context and be kind in our judgments. At the time, some of this goofy lingo was at the cutting edge. Real weak points? The wounded veterans get together and argue with each other about how much of a collective future they have and the argument is oversimply resolved with a conclusion along the lines of, ""Just because you have a silver plate in your head doesn't mean people will think you're a bad person."" There are sometimes voice overs and silent prayers that are both unnecessary and downright unimaginative. ""Please, God, let him return to me,"" and that sort of thing. Well, the film makers were operating within the constraints of their times. Maybe that's why the final fade is on a shot of Independence Hall and the inspiring strains of ""America the Beautiful"" swell in the back. None of this can undo the film's virtues, which are considerable, particularly the impact of that horrifying combat scene. It's not on television that often. If you have a chance, by all means catch it.",pos
"i tried to sit through this bomb not too long ago.what a disaster .the acting was atrocious.there were some absolutely pathetic action scenes that fell flat as a lead balloon.this was mainly due to the fact that the reactions of the actors just didn't ring true.supposedly a modern reworking of the Hitchcock original ""Lifeboat"".i think Hictcock would be spinning circles in his grave at the very thought of it.from what i was able to suffer through,there is nothing compelling in this movie.it boasts a few semi big names,but they put no effort into their characters.but,you know,to be fair,it was nobody's fault really.i mean,i'm pretty sure the script blew up in the first explosion. LOL.it is possible that this thing ends up improving as it goes along.but for me,i'm not willing to spend at least three days to find out.so unless you have at least a three day weekend on the horizon,avoid this stinker/ 1/10",neg
