text,label
"Well, I finally saw it. I didn't go when it first came out because, well, frankly, I was afraid. Afraid of how bad it might be, or how disappointing. While not as bad as Menace, and better than Clones, it wasn't particularly memorable, or satisfying.I was 11 years old when I saw Star Wars. I still remember sitting in the theater. From the opening crawl to the final credits it was a movie experience I'll never forget. A timeless story of the bored farm-boy who just knows he was meant for more, saving the princess and the Galaxy from the evil menace while being mentored by the wise wizard, the rogue pirate and the various comic relief--all in a space-opera setting.And that's not to chastise Lucas for using an old formula. It's an old formula precisely because it works. And to his credit, he gave it new twists that made it very special.Then came Empire and the story became more than just a fairy tale. Darkness entered the picture and we learned one of the great movie twists of all time. The great villain, Vader was Luke's father. Wow, no one saw that coming. Of course, I'm convinced neither did Lucas till it showed up in the screenplay. Go back and watch Star Wars again. Knowing what you know now, particularly in light of the first three episodes, see if it really meshes.Which brings me to the problem I have. Revenge is an entertaining movie--tremendous effects, plenty of action, some good fighting scenes. But a movie still lives or dies on its plot--the story it is telling. Oh, certainly, really good acting can save a weak plot, but a weak plot coupled with bad acting--that's a burden no director can overcome, certainly not one as bad as I'm forced to realize George Lucas is (The man has managed to direct some of the worst performances in their careers from some very fine actors--Liam Neeson, Natalie Portman, Samuel Jackson).*****SPOILERS AHEAD******** The plot. Oh my. Understand, he's already handicapped by what's happened in the first two films so it's an incredible burden. One too much for him to overcome.First we have the sheer absurdities of the background. We have Anakin being found as a child on Tatooine, the product of a virginal, miracle birth--the ""chosen one"". Well, this detail never gets remotely explained. Indeed, the closest explanation is Yoda's observation that maybe they were wrong. Oh, well, okay then. Our mistake.Now, this same wunderkind turns out to be the creator of C3PO. Hey, what a coincidence that is. And he'll come back to Tatooine and never know he was from there? Wow! How about that. Testing the old willing suspension of disbelief there, eh George? Anyway, we have this bratty kid, moody, petulant, whining young adult, who must somehow become one of the greatest villains in Cinematic history--the great tragedy of Darth Vador--the good guy who falls from grace, only to finally achieve redemption in the end.How, pray tell, does this happen? Why, he has a dream that his wife will die in childbirth. Now, sure, he lives in a star-spanning civilization that treats gravity like we treat gasoline, but does it occur to the ""dark one to be"" to maybe check with a physician cause maybe, just maybe, this futuristic society might can do something about this problem? Why, no, the only thing he can think to do is go kill some children because the bad guy at the root of all the evil they've been chasing for two films tells him that he's got the secret to immortality.Well, of course he does.Sheesh.How can Lucas expect us to watch such foolishness and be moved by it? How can anyone expect us to care? Hell, why would anyone want this brat to be saved or redeemed in the first place. I wanted Kenobi to kill him not because he was evil, but because he was pathetically stupid.Oh, by the way, Amidala finally dies. In childbirth. Why? Well, they don't know. The doctor, who is a droid and himself indicative of the incredibly high technology to which this society has advanced, offers only the conclusion of ""she's lost the will to live"". Well, oh, okay, of course she has. Maybe it finally dawned on her what a dweeb she was sleeping with.But here we are. We have Kenobi present for all this. He knows of the birth of Luke and Leia. Knows who their father is and knows what happens to them. Knows, also, the role of both R2 and C3PO. And yet, in several years, as Luke approaches manhood and shows up with 3PO and R2 (curiously, 3PO's mind is wiped, but not R2's--why????) stating ""I think these droids belong to you"", Kenobi, who knows that the protocol droid was constructed by the one he believed to be ""the chosen one"" and apprentice to the Emperor himself, and who just happened to be built on this very planet, says ""strange, I don't recall owning any droids"".Oh good grief.Lucas simply made this up as he went along. Once he introduced VAder as Luke's father, sadly, the story began spinning out of control because HE DIDN'T KNOW WHAT THE STORY WAS. The plot of Episodes 1-3 is simply incomprehensible. Nothing Palpatine did made any rational sense at all. And none of this ties into the story he originally told in Star Wars.It's an afterthought, and it looks it.I can't give this movie a high rating. It reminds me of Triple X. A fun film to watch, but entirely forgettable. Star Wars will stand in my mind forever. Thankfully, this one, and the two preceding it, will soon fade.",neg
"Satan's Little Helper is one of the better B Horror movies I have seen. When I say better I mean the story. The film hatches a new plot, something that's not so cliché in the Horror genre - something fresh. But there are also some ridiculous questions that come along with it. Questions you will be asking yourself throughout the movie.The film first caught my attention while I was cruising the Horror section in HMV. I was tired of all the so called ""terrifiying"" Hollywood blockbusters and wanted something different. The cover art for Satan's Little Helper immediately caught my attention. As you can see, the image draws you in - it's chilling! I knew it was a straight to DVD release - but I took a chance. I mean, I just seen ""Boogey Man"" the night before - so It couldn't get any worse! After I watched the movie, I was semi-satisfied. I loved the plot of the movie. It was really creepy how the killer was pretending to be the little boys friend, so he could kill. In some sick deranged way, he actually thought he and the little boy would become partners - a duo of terror. It was a great idea to set the film on Halloween night. This way, no one would think anything of a masked man beside a little kid. They would simply think he was his guardian. But, this is also where the ""plot holes"" begin to surface.If your son came home with a ""friend"" he met trick or treating - that's fine. You wouldn't think anything of it - if he was 9!, or round about the same age as him. If however, he appeared with a strange man in a mask, you would be startled and protective of your child. You would ask the man to remove his mask and identify himself. You would ask why he is with your son. He doesn't know him. You would tell him to please leave. He isn't a family friend. He's a stranger. Now, we're supposed to teach our child not to talk to strangers. In this case, the mum is completely fine with it. Huh? They never seem to think it's a tad odd that the ""man"" doesn't speak - at all. Gruanted they think it's the daughters boyfriend, but after 10 minutes of not talking you would pull the mask off and ask him why he's not saying a word.The film goes down hill from there. The thing that got me the most was, all the mum said was ""Do you want some cider?"". I can't count how many times she says this in the movie. It's like, oh you're dying - we have cider though, it's all good!! The movie started promising, and failed to deliver. It was more of a horror/comedy, and even as that it fails to deliver. I guess you could call it a ""Dud"",""Flop"" etc..The best thing about the movie is the cover art. Though, something tells me that's not worth the 12 dollars!",neg
"Last of the Johnny Weissmuller Tarzan films and a good thing too, as this is easily the worst of the 12 films he made over a period of 16 years. No mermaids are featured here either as a beautiful island woman tries to escape the clutches of her people, who worship a god and try to force her to be its bride. She finds Tarzan and Jane, who try to protect her. George Zucco is present as a potentially villainous High Priest but isn't used to his full advantage. Also on hand and worthy of mention is a hugely annoying guitar player/singer who goes into song every so often. Even the ""great"" Robert Florey can't aid this one.*1/2 (of four)",neg
"A fey story of a Martian attempt to colonize Earth. (Things must be pretty bad back on Mars.) Two state troopers investigate the scene of a reported UFO crash. Whatever landed is buried under the ice at Tracy's Pond but there are footsteps in the snow leading to a nearby diner.The diner has had no customers since eleven o'clock that morning. Now there are a handful of bus passengers sitting around waiting for permission to cross a structurally weak bridge. The bus driver insists that six passengers were aboard the bus, although he didn't notice who they were. The problem is that there are now SEVEN people waiting for the journey to be resumed. One of them is an alien, but which one? All of them are suspect. There's the crazy old man (Jack Elam), of course, who seems to exercise a sub rosa wit. There's a blustering businessman who must get to Boston (John Hoyt). A young couple on their honeymoon. (Execrable performance by the husband, Ron Kipling.) Except for the couples, nobody has noticed anyone else. And even the couples are suspicious of each other. Bride to newly minted husband: ""I could have sworn you had a mole on your chin."" The story continues in a sprightly but slightly spooky way -- the phone rings for no reason, the lights go on and off, the juke box turns itself on -- and none of it is to be taken seriously.It's a thoroughly enjoyable ensemble play and the climactic revelation is worth a chuckle. There is no discernible ""depth"" to it. It's not a moral message about pod people masquerading as normal citizens. It's not a warning of any kind, just a fairy tale that diverts and amuses.I always enjoy it when it's on. It's especially interesting to see John Hoyt as the irritable and impatient businessman, knowing that in 1954 he was the Roman Senator who masterminded the assassination of Julius Caesar in MGM's version of Shakespeare's play. And here he is -- with three arms.Oops.",pos
"The third and last film of this trilogy is finally crystal clear. It is a political film more than a plain entertainment. Jason Bourne will finally know who he was and he will discover and remember the tortures he was submitted to in order to kill his old identity: he really killed some one who became his corpse. But the film is finally revealing that all this had been organized and planned by the CIA within a Blackfriars program that is also clearly revealed in this film as aiming at eliminating all American citizens who tried to prevent the control of the whole society by an established and limited group of people. Who was one essential officer of the CIA up to 1980, when he became vice president? That goes along with what is being said on the Internet. Then the truth will come thanks to Jason Bourne himself but the main person who will be able to bring that truth to the public and the only authority that can take a decision concerning the CIA is a woman and that woman gets the Senate involved in a general investigation. A woman and the Senate; read my lips. In the USA politics are fought in the media and two media are essential for any presidential campaign: it is music and the cinema. Right now Hollywood and beyond the intelligentsia, academia and intellectuals are using the cinema in general, and this film in particular, to build up the idea in the public that salvation will come from a woman and from the Senate. So go and watch the film. It is pretty entertaining and it has the sweet fragrance of the end of a period and of the great change some are expecting and others are waiting for, but no one is able to pretend it won't come: the only point is to know how deep and serious it will be.Dr Jacques COULARDEAU, University Paris Dauphine, University Paris 1 Pantheon Sorbonne & University Versailles Saint Quentin en Yvelines",pos
"What is ""Cry Freedom"" like? It is simply great and unique experience about making of South Africa and how black people in that country were repressed by white people. Main character of the story is Donald Woods (Kevin Kline), chief editor of the newspaper Daily Dispatch in South Africa. Woods writes several articles, where he speaks critically about views of Steve Biko (Denzel Washington). Soon Woods meets Biko and he changes his views about him and he also begins to understand what authorities are doing to black people in South Africa (right from the top, even from the chief of police). When Biko dies in police custody, Woods decides that he have to write book about him and that no matter what he has to publish it. But Woods must escape from his country to get that book published and he must also put his family on second place, so world can find out the truth.Attenborough managed to make a good movie about people, with main message that black and white are the same, cause we are all people. Story leads us to South Africa and this (movie) is great way for the whole world to learn what happened in that land and I'm disappointed that only 3200 people rated this movie. This is movie from which we all can learn something. Although it is a bit long, this story couldn't be presented in any shorter way because director wanted to show us how hard was for Woods to get that book published after death of Biko. Also relationship between Woods and Biko was shown great, just like families of those two people and all the problems they are going through. But sometimes sacrifices must be made (Biko's death) so the truth could be reveled (Woods book).",pos
"It's beyond my comprehension that so much rubbish from Norway has been remastered for DVD release, and still gems like this don't get a shot at recapturing their past glory. I give this a 7, not because it is very good, but because it is one of the few SciFi films made for Norwegian television. This film is nothing less than a film-historic gem that in so many ways foreshadows the first Alien film. And, my word, Blindpassasjer was first! Did Ridley Scott or anyone in the crew see the mini-series? However unlikely, the fact remains that the scenes are extremely similar. Okay, the budget is _much_ lower in the Norwegian film, but given that, it's a really well-done piece of work from the desolate age of Norwegian movie-making, which incidentally lasted until the 90s.",pos
"This movie was excellent for the following reasons: 1) It contained great backdrops and sets. 2) It showed the disparity of a war-torn environment alongside a technological one. 3) John Cusack's acting was terrific. He portrayed angst very well. 4) It showed the vulnerabilities of everyone in a war-torn situation. 5) It gave us a picture of what might happen in the future in many respects. I was also impressed with the acting for the most part. Hilary's acting was, I found, the most stilted. The morals and values of everyone in a war-torn situation are up for grabs. The liberal journalist and the conservative business man are capable of doing anything in any situation and are equally unpredictable. Great stuff. PSP",pos
"The Good Earth is perhaps the most boring film I've seen in my life. The plot is slow and lacking. The acting is borderline comical. While I love Paul Muni, I can now say i have seen a film that does not do his true ability justice. The only saving grace I found with this film is it's production value. The use of hundreds of extras throughout the film creates a very believable and interesting environment. Also, the beautiful effects used to create the illusion of millions of wasps sells easily and was revolutionary at the time. Other than the production value I can say little else that is good or entertaining about this film.",neg
"Sergio Martino is a great director, who has contributed a lot to Italian genre cinema and, as far as I am considered, his Gialli from the 1970s are the undisputed highlights in his impressive repertoire. ""La Coda Dello Scorpione"" aka. ""The Case Of The Scorpion's Tale"" of 1971 is one of these impressive films Martino has contributed to Italian Horror's most original sub-genre, and another proof that the man is a master of atmosphere, style and suspense. My personal favorite of the Martino films I've seen so far is still the insanely brilliant ""Your Vice Is A Locked Room And Only I Have The Key"" of 1972, followed by ""Torso"" (1973) and ""The Strange Vice Of Mrs Wardh"" (1971), all of which I personally like even more than this one. That's purely a matter of personal taste, however, as ""La Coda Dello Scorpione"" is an equally excellent film that is essential for every fan of Italian Horror cinema and suspense in general.The film, which delivers tantalizing suspense from the very beginning has a complex and gripping plot that begins with the mysterious demise of a millionaire who has died in a plane crash. Insurance investigator Peter Lynch (George Hilton) is assigned to verify the circumstances the insurance company which is due to pay a large sum to the deceased man's wife. Soon after Lynch begins to investigate, a person is brutally killed, which is just the beginning of a series of murders...""The Case of the Scorpion's Tail"" excellently delivers all the elements a great Giallo needs. The film is stunningly suspenseful from the beginning, the score by Bruno Nicolai is brilliant, the plot is wonderfully convoluted, and the killer's identity remains a mystery until the end. Regular Giallo leading-man George Hilton once again delivers an excellent performance in the lead. Sexy Anita Strindberg is absolutely ravishing in the female lead. The includes the great Luigi Pistilli, one of the most brilliant regulars of Italian genre-cinema of the 60s and 70s, and Alberto De Mendoza, another great actor who should be familiar to any lover of Italian cinema. Athens, where most of the film takes place, is actually a great setting for a Giallo. The atmosphere is constantly gripping, and the photography great, and Bruno Nicolai's ingenious score makes the suspense even more intense. Long story short: ""La Coda Dello Scorpione"" is another excellent Giallo from Sergio Martino and an absolute must-see for any lover of the sub-genre! Stylish, suspenseful, and great in all regards!",pos
"While I am not a big fan of musicals, I have loved the films of Fred Astaire and Ginger Rogers because they are just so much fun. Sure, they can be a bit formulaic, but even though you KNOW what is going to happen, they still are very pleasing to watch. However, despite this, I was a bit disappointed in this outing. Part of it was because this film doesn't have the wonderful supporting cast like you saw in TOP HAT or SHALL WE DANCE. Without Edward Everett Horton or Eric Blore, the film seems to be a bit lacking--especially in the ""fun"" department. The silly antics of these supporting actors gave the other films charm that you just don't get with FOLLOW THE FLEET. In addition, unlike the usual character played by Astaire, this one is more of a jerk--as his fat head gets Rogers into trouble again and again. And, as a result, it's a lot harder to like him or want to see them get together in the end of the film. Plus, although the music is by Irving Berlin, the songs just don't seem as memorable. In fact, none of the songs were all that special and I can't recall any of them even though I just saw the movie. While this is still a cute and worthwhile film, it just lacks the sparkle and magic of some of their other films. Good but far from great.",pos
